Text,Labels,PII,Labels_found,PII_found,Match_Labels,Match_PII
Candidate economic character present money daughter Apt. 026 world well. Open analysis center.,Address,Apt. 026,Address,Apt. 026,TRUE,TRUE
Film range sound. People age Apt. 476 that.,Address,Apt. 476,Address,Apt. 476,TRUE,TRUE
Back want myself class certain. Tree pretty career environment change letter top. Suite 492,Address,Suite 492,Address,Suite 492,TRUE,TRUE
"Bring guy 81627 Kimberly Squares Washingtonberg, RI 13540 hold green girl.",Address,"81627 Kimberly Squares Washingtonberg, RI 13540",Address,"81627 Kimberly Squares Washingtonberg, RI 13540",TRUE,TRUE
"52013 Jason Vista Lake Kathleen, PA 89168 May lay not boy case citizen. Woman executive dog pull traditional dinner.",Address,"52013 Jason Vista Lake Kathleen, PA 89168",Address,"52013 Jason Vista Lake Kathleen, PA 89168",TRUE,TRUE
"Themselves early our bit. Institution peace spring 4058 Gordon Fields South Charlestown, NJ 40537 agree ever. Involve do play realize true consumer reality.",Address,"4058 Gordon Fields South Charlestown, NJ 40537",Address,"4058 Gordon Fields South Charlestown, NJ 40537",TRUE,TRUE
11792 Stevens Ferry Career respond front happen decide. History hair least exist sit similar them. Play near near middle natural rich.,Address,11792 Stevens Ferry,Address,11792 Stevens Ferry Career,FALSE,FALSE
Fine during five spring Apt. 174 page where language. Partner onto fight your treat already best. Professional town media hope newspaper order.,Address,Apt. 174,Address,Apt. 174,TRUE,TRUE
"Cup 52013 Jason Vista Lake Kathleen, PA 89168 item remain environment not. Foot nation key high seek eight.",Address,"52013 Jason Vista Lake Kathleen, PA 89168",Address,"52013 Jason Vista Lake Kathleen, PA 89168",TRUE,TRUE
Question Suite 052 as should sign face. Memory approach month back.,Address,Suite 052,Address,Suite 052,TRUE,TRUE
Sound improve parent dream 57439 Barron Shoals Apt. 718 send language. Hundred better down understand treatment able. Partner kid want feel action yeah.,Address,57439 Barron Shoals Apt. 718,Address,57439 Barron Shoals Apt. 718,TRUE,TRUE
We 57439 Barron Shoals Apt. 718 trial win. Indeed hotel dream. Poor friend go east above.,Address,57439 Barron Shoals Apt. 718,Address,57439 Barron Shoals Apt. 718,TRUE,TRUE
Series painting development simply good. Hour cultural so only USNS Pugh FPO AA 12405 group.,Address,USNS Pugh FPO AA 12405,Address,USNS Pugh FPO AA 12405,TRUE,TRUE
Gun Suite 281 billion skin. Find success force state within.,Address,Suite 281,Address,Suite 281,TRUE,TRUE
Wear language Apt. 476 word kitchen might figure miss join. Large hear security year during reach watch.,Address,Apt. 476,Address,Apt. 476,TRUE,TRUE
Organization rich Suite 751 indicate medical everyone industry. Under word director value. Candidate help anything weight specific.,Address,Suite 751,Address,Suite 751,TRUE,TRUE
"Job security fall 32266 Patterson Plain Suite 265 Alexandrashire, HI 19906 bad good relationship. List area away federal necessary. Wind all stage time animal.",Address,"32266 Patterson Plain Suite 265 Alexandrashire, HI 19906",Address,"32266 Patterson Plain Suite 265 Alexandrashire, HI 19906",TRUE,TRUE
Lay case final. East dark week account structure red company Suite 056 give.,Address,Suite 056,Address,Suite 056,TRUE,TRUE
"Community stand nice whatever film. Blood go particular same wait record interview. Position sometimes test shoulder 71707 Leblanc River New Annaborough, ID 83252 save huge course. Almost they himself less interesting education.",Address,"71707 Leblanc River New Annaborough, ID 83252",Address,"71707 Leblanc River New Annaborough, ID 83252",TRUE,TRUE
View consumer our. Kind simple support. Operation Democrat off red economic environment human. 73727 Rebecca Spur Suite 674,Address,73727 Rebecca Spur Suite 674,Address,73727 Rebecca Spur Suite 674,TRUE,TRUE
Soon study though Apt. 406 once. Former grow around morning guy activity.,Address,Apt. 406,Address,Apt. 406,TRUE,TRUE
Although foreign national clearly church establish in first. Approach situation hair animal team. Across hospital 049 Andrea Loaf bag.,Address,049 Andrea Loaf,Address,049 Andrea Loaf,TRUE,TRUE
Mission throughout small USNS Wilson FPO AE 70648 save still lay discussion according. Spend man finally finish some officer.,Address,USNS Wilson FPO AE 70648,Address,USNS Wilson FPO AE 70648,TRUE,TRUE
"Member evening ready. Choose 60467 Deborah Vista Apt. 146 Port Karenfurt, VT 68081 quality traditional create town common American.",Address,"60467 Deborah Vista Apt. 146 Port Karenfurt, VT 68081",Address,"60467 Deborah Vista Apt. 146 Port Karenfurt, VT 68081",TRUE,TRUE
"Support do total threat exist material. Here boy 970 Bethany Fords Suite 491 West Lisaside, NC 08207 move much. Candidate will data agency field care. Page task opportunity door board sound ready.",Address,"970 Bethany Fords Suite 491 West Lisaside, NC 08207",Address,"970 Bethany Fords Suite 491 West Lisaside, NC 08207",TRUE,TRUE
Close pressure finally. Young question Mrs 156 John Gardens leg group president.,Address,156 John Gardens,Address,156 John Gardens,TRUE,TRUE
"Quality whom pay travel our table course. 970 Bethany Fords Suite 491 West Lisaside, NC 08207 Likely other out.",Address,"970 Bethany Fords Suite 491 West Lisaside, NC 08207",Address,"970 Bethany Fords Suite 491 West Lisaside, NC 08207",TRUE,TRUE
Relationship what family state time artist side. Oil second social collection east natural during. Popular lead its federal Apt. 798 eight I.,Address,Apt. 798,Address,Apt. 798,TRUE,TRUE
Everyone road skill Apt. 392 act condition heart real wear. Left song very foreign bed soldier.,Address,Apt. 392,Address,Apt. 392,TRUE,TRUE
Fight strategy maintain every Suite 298 because religious bed.,Address,Suite 298,Address,Suite 298,TRUE,TRUE
Suite 993 Most nor star remain.,Address,Suite 993,Address,Suite 993,TRUE,TRUE
Team Republican him reveal. Player party 4572 Hanson Prairie leg beyond.,Address,4572 Hanson Prairie,Address,4572 Hanson Prairie,TRUE,TRUE
"One than light class. Between 942 Steven Drive Apt. 072 Schroederland, MT 12514 impact those cold truth.",Address,"942 Steven Drive Apt. 072 Schroederland, MT 12514",Address,"942 Steven Drive Apt. 072 Schroederland, MT 12514",TRUE,TRUE
During technology weight appear gun. Soon claim method. Parent between role Suite 492 travel.,Address,Suite 492,Address,Suite 492,TRUE,TRUE
Room Suite 987 up generation free discover grow. Pattern authority effort himself. Avoid lawyer name.,Address,Suite 987,Address,Suite 987,TRUE,TRUE
"Never break about risk. 3996 Rocha Street Suite 703 New Ianshire, NM 16212 Pay number west economic test involve agent boy. Number least seat expert class watch work.",Address,"3996 Rocha Street Suite 703 New Ianshire, NM 16212",Address,"3996 Rocha Street Suite 703 New Ianshire, NM 16212",TRUE,TRUE
Strong whole head name mean. American lose animal well Apt. 212 position strategy growth Republican. Common the term ability choice Republican last.,Address,Apt. 212,Address,Apt. 212,TRUE,TRUE
"Ok dream campaign task six only Congress. Score account fund various onto will. 0095 Laura Drive Apt. 024 South Debrachester, TX 27760",Address,"0095 Laura Drive Apt. 024 South Debrachester, TX 27760",Address,"0095 Laura Drive Apt. 024 South Debrachester, TX 27760",TRUE,TRUE
425 Jones Expressway Suite 280 Town minute culture throughout business. Under stay occur hot.,Address,425 Jones Expressway Suite 280,Address,425 Jones Expressway Suite 280,TRUE,TRUE
Radio respond perhaps western loss blood. Turn list economy itself executive indeed with. Final so environmental relationship or arrive idea church. Fast 9231 Regina Locks exactly raise city push live benefit else.,Address,9231 Regina Locks,Address,9231 Regina Locks,TRUE,TRUE
Approach article scene though respond white song. Pick PM even white still. Apt. 852 Keep north reflect away property standard.,Address,Apt. 852,Address,Apt. 852,TRUE,TRUE
"Cell town administration arm. Say range watch our 08290 Taylor Turnpike Apt. 146 Darleneshire, WA 42147 shoulder as.",Address,"08290 Taylor Turnpike Apt. 146 Darleneshire, WA 42147",Address,"08290 Taylor Turnpike Apt. 146 Darleneshire, WA 42147",TRUE,TRUE
Goal agent resource office material game. Lot scene help. Answer 232 Lewis Path Suite 885 visit southern situation. Fall country win out rather dinner marriage.,Address,232 Lewis Path Suite 885,Address,232 Lewis Path Suite 885,TRUE,TRUE
"History effort system kitchen. Heart your 8278 Torres Branch Apt. 177 Robertsburgh, NJ 06130 situation act forget question factor. Evening be white will work debate.",Address,"8278 Torres Branch Apt. 177 Robertsburgh, NJ 06130",Address,"8278 Torres Branch Apt. 177 Robertsburgh, NJ 06130",TRUE,TRUE
"Leader any type improve first PSC 7100, Box 9109 APO AE 64069 black child. Avoid list political thing. Model during white note various night.",Address,"PSC 7100, Box 9109 APO AE 64069",Address,"PSC 7100, Box 9109 APO AE 64069",TRUE,TRUE
Thank realize edge quality agency. Mrs produce manage this people see police. Hospital campaign message create people 069 Jack Park Apt. 334 concern. Order bring alone set including.,Address,069 Jack Park Apt. 334,Address,069 Jack Park Apt. 334,TRUE,TRUE
Discover author see president return man last. Black door already card increase 4572 Hanson Prairie dog minute. Think approach itself season.,Address,4572 Hanson Prairie,Address,4572 Hanson Prairie,TRUE,TRUE
Easy have whatever point better. Instead Suite 790 measure game.,Address,Suite 790,Address,Suite 790,TRUE,TRUE
"Party woman past grow edge. 71707 Leblanc River New Annaborough, ID 83252 Pretty eat Democrat source return party.",Address,"71707 Leblanc River New Annaborough, ID 83252",Address,"71707 Leblanc River New Annaborough, ID 83252",TRUE,TRUE
Series seem sister health. Identify company authority Suite 281 seek scene concern. Yes pick father.,Address,Suite 281,Address,Suite 281,TRUE,TRUE
Old to health ask Apt. 174 figure. Fill when hotel girl yet fill defense service. Someone page successful.,Address,Apt. 174,Address,Apt. 174,TRUE,TRUE
Movie statement leader ready ok follow debate. Trouble work article author fish. Apt. 264 Radio glass individual fact work road though positive.,Address,Apt. 264,Address,Apt. 264,TRUE,TRUE
Exist establish we reason job record Suite 056 accept. Western nearly region own view protect.,Address,Suite 056,Address,Suite 056,TRUE,TRUE
First resource test rate. Father beat family prove meeting customer. Strategy Apt. 745 both ground able light service during.,Address,Apt. 745,Address,Apt. 745,TRUE,TRUE
Civil notice travel commercial. Consumer itself edge generation wait magazine sister. Hour Suite 790 care help foreign his test.,Address,Suite 790,Address,Suite 790,TRUE,TRUE
Also six million group reach future. Personal politics performance magazine mention institution relationship. Suite 993 Health present true pressure.,Address,Suite 993,Address,Suite 993 Health,FALSE,FALSE
Program indicate whose attorney five according. Young 347 Nancy Track Apt. 102 citizen interview speech nor. Everything five clear left quite watch home sound.,Address,347 Nancy Track Apt. 102,Address,347 Nancy Track Apt. 102,TRUE,TRUE
Such today election away. Month color officer room no. Weight 37808 Teresa Terrace night letter care too.,Address,37808 Teresa Terrace,Address,37808 Teresa Terrace,TRUE,TRUE
"Nature American should reduce two. Store 0095 Laura Drive Apt. 024 South Debrachester, TX 27760 goal entire prove sure Democrat hope. Dog can computer.",Address,"0095 Laura Drive Apt. 024 South Debrachester, TX 27760",Address,"0095 Laura Drive Apt. 024 South Debrachester, TX 27760",TRUE,TRUE
Defense region trade hold bed time audience choice. Sell of heart. 432 Little Inlet Suite 844 Practice north white off.,Address,432 Little Inlet Suite 844,Address,432 Little Inlet Suite 844 Practice,FALSE,FALSE
Still yes USNS Wilson FPO AE 70648 everyone section center feel. View real late. Test financial success apply.,Address,USNS Wilson FPO AE 70648,Address,USNS Wilson FPO AE 70648,TRUE,TRUE
"Certainly success training idea large. Majority food behind. Project voice alone trouble. 50691 Garcia Centers Ryanfurt, MD 94946 Away relationship mother.",Address,"50691 Garcia Centers Ryanfurt, MD 94946",Address,"50691 Garcia Centers Ryanfurt, MD 94946",TRUE,TRUE
Around well meet whose five Apt. 026 before. Some or most add. Want option meeting say.,Address,Apt. 026,Address,Apt. 026,TRUE,TRUE
"52013 Jason Vista Lake Kathleen, PA 89168 Federal nice this idea sell. If somebody watch without best.",Address,"52013 Jason Vista Lake Kathleen, PA 89168",Address,"52013 Jason Vista Lake Kathleen, PA 89168",TRUE,TRUE
Year Suite 503 not special must run since. Stuff their better of public good.,Address,Suite 503,Address,Suite 503,TRUE,TRUE
"Add three Democrat deep bill appear. Or box 510 Hayley Dam Suite 045 Port Tracychester, MT 73050 traditional majority. Analysis fly teacher court like president.",Address,"510 Hayley Dam Suite 045 Port Tracychester, MT 73050",Address,"510 Hayley Dam Suite 045 Port Tracychester, MT 73050",TRUE,TRUE
Feel thank whether threat spring third position. Away magazine whatever source answer ability. Election Apt. 264 shoulder like student peace.,Address,Apt. 264,Address,Apt. 264,TRUE,TRUE
"She late away line recent employee. Several past personal. 510 Hayley Dam Suite 045 Port Tracychester, MT 73050",Address,"510 Hayley Dam Suite 045 Port Tracychester, MT 73050",Address,"510 Hayley Dam Suite 045 Port Tracychester, MT 73050",TRUE,TRUE
2339 Rodriguez Overpass Suite 686 Nearly but foreign. Much value beat second poor feeling work. Then picture them water window.,Address,2339 Rodriguez Overpass Suite 686,Address,2339 Rodriguez Overpass Suite 686,TRUE,TRUE
Character film whole above operation player cause. 232 Lewis Path Suite 885,Address,232 Lewis Path Suite 885,Address,232 Lewis Path Suite 885,TRUE,TRUE
Drop yet bad each whose. Machine 3120 Patricia Skyway board size special care hear.,Address,3120 Patricia Skyway,Address,3120 Patricia Skyway,TRUE,TRUE
"Road audience large this. Future artist condition cut. Recent 32266 Patterson Plain Suite 265 Alexandrashire, HI 19906 still a trip fine. Thought again ever price shake relate.",Address,"32266 Patterson Plain Suite 265 Alexandrashire, HI 19906",Address,"32266 Patterson Plain Suite 265 Alexandrashire, HI 19906",TRUE,TRUE
Upon some challenge Democrat perhaps. Suite 281 Way beat institution another decide behavior agent.,Address,Suite 281,Address,Suite 281 Way,FALSE,FALSE
"Again 970 Bethany Fords Suite 491 West Lisaside, NC 08207 while skill difficult responsibility. Hard woman final. But still system top.",Address,"970 Bethany Fords Suite 491 West Lisaside, NC 08207",Address,"970 Bethany Fords Suite 491 West Lisaside, NC 08207",TRUE,TRUE
Apt. 476 Try arrive vote moment recognize. Compare ever over house list quickly.,Address,Apt. 476,Address,Apt. 476,TRUE,TRUE
"Network article for eight same. Receive meet service true other. Law already people add style paper eye. 60467 Deborah Vista Apt. 146 Port Karenfurt, VT 68081",Address,"60467 Deborah Vista Apt. 146 Port Karenfurt, VT 68081",Address,"60467 Deborah Vista Apt. 146 Port Karenfurt, VT 68081",TRUE,TRUE
"Any information garden to citizen movie hear authority. Full control method debate project product list. Fall public individual action imagine agent. 92546 Clark Vista Stephenton, IL 39677",Address,"92546 Clark Vista Stephenton, IL 39677",Address,"92546 Clark Vista Stephenton, IL 39677",TRUE,TRUE
Same likely fear detail clearly. And song find power toward sometimes leader. Family coach like outside price financial. Suite 751,Address,Suite 751,Address,Suite 751,TRUE,TRUE
Break light base sea. Magazine decide crime government wrong half consider. Herself decide 80503 Richardson Stravenue Apt. 395 produce its against off many exist.,Address,80503 Richardson Stravenue Apt. 395,Address,80503 Richardson Stravenue Apt. 395,TRUE,TRUE
Effect born weight democratic official agreement. Glass hear artist not Apt. 479 teacher.,Address,Apt. 479,Address,Apt. 479,TRUE,TRUE
Talk while American suddenly participant second account. Anything whole ok Apt. 212 car store tough want manager.,Address,Apt. 212,Address,Apt. 212,TRUE,TRUE
Camera wall continue top us clearly hot including. Suite 695,Address,Suite 695,Address,Suite 695,TRUE,TRUE
Course college still loss Apt. 745 scene. Series many speech law film.,Address,Apt. 745,Address,Apt. 745,TRUE,TRUE
Movement near value 61568 Sean Heights Suite 787 number able ability result table.,Address,61568 Sean Heights Suite 787,Address,61568 Sean Heights Suite 787,TRUE,TRUE
Pull key other nor save perform. List service ready yard 4572 Hanson Prairie clearly.,Address,4572 Hanson Prairie,Address,4572 Hanson Prairie,TRUE,TRUE
Ready Suite 790 off score foot market protect.,Address,Suite 790,Address,Suite 790,TRUE,TRUE
432 Little Inlet Suite 844 Up course education involve thousand. Treat scientist actually study avoid education. Floor out language laugh tough rule investment.,Address,432 Little Inlet Suite 844,Address,432 Little Inlet Suite 844,TRUE,TRUE
Huge develop environmental president their. Manage could 4836 Thomas Garden outside professional power question this. Point learn tonight again whom true rate.,Address,4836 Thomas Garden,Address,4836 Thomas Garden,TRUE,TRUE
"60467 Deborah Vista Apt. 146 Port Karenfurt, VT 68081 Possible both develop claim. Call than message simple class.",Address,"60467 Deborah Vista Apt. 146 Port Karenfurt, VT 68081",Address,"60467 Deborah Vista Apt. 146 Port Karenfurt, VT 68081",TRUE,TRUE
Describe question cover suggest actually with. Course fly hope Suite 492 require she. Season real keep each sign fly. Common take compare force.,Address,Suite 492,Address,Suite 492,TRUE,TRUE
"Per learn 7759 Jonathan Street Apt. 106 New Benjaminmouth, MN 91683 agree despite smile him foot. Wait should effect from. Close make result. Fish strong which force next teach newspaper.",Address,"7759 Jonathan Street Apt. 106 New Benjaminmouth, MN 91683",Address,"7759 Jonathan Street Apt. 106 New Benjaminmouth, MN 91683",TRUE,TRUE
"Director thousand manager give board white. Result how more southern. Fact 60467 Deborah Vista Apt. 146 Port Karenfurt, VT 68081 guess to.",Address,"60467 Deborah Vista Apt. 146 Port Karenfurt, VT 68081",Address,"60467 Deborah Vista Apt. 146 Port Karenfurt, VT 68081",TRUE,TRUE
Report author increase a receive watch. Book rather imagine. Decision hit result able store future development Suite 021 source.,Address,Suite 021,Address,Suite 021,TRUE,TRUE
Positive cause I arrive night site wind. Throughout mind over 4484 Lisa Pass he collection hit. Fall challenge action through.,Address,4484 Lisa Pass,Address,4484 Lisa Pass,TRUE,TRUE
"Store effort campaign girl worker technology. Fact reach 309 Bryan Islands Suite 301 Lake Valerie, CO 92860 somebody sense. Run run tonight soldier. World trade play account up single.",Address,"309 Bryan Islands Suite 301 Lake Valerie, CO 92860",Address,"309 Bryan Islands Suite 301 Lake Valerie, CO 92860",TRUE,TRUE
Coach he west magazine against 347 Nancy Track Apt. 102 beat. By sometimes series time whole election prove. Series protect program may peace answer.,Address,347 Nancy Track Apt. 102,Address,347 Nancy Track Apt. 102,TRUE,TRUE
Speech national especially available own black alone. After friend religious unit Apt. 646 movement not pretty all.,Address,Apt. 646,Address,Apt. 646,TRUE,TRUE
"Forward 8278 Torres Branch Apt. 177 Robertsburgh, NJ 06130 listen step this community financial most. Deal item all. Subject consider care training.",Address,"8278 Torres Branch Apt. 177 Robertsburgh, NJ 06130",Address,"8278 Torres Branch Apt. 177 Robertsburgh, NJ 06130",TRUE,TRUE
"Test artist person billion. Trouble staff industry measure sense before. 4058 Gordon Fields South Charlestown, NJ 40537",Address,"4058 Gordon Fields South Charlestown, NJ 40537",Address,"4058 Gordon Fields South Charlestown, NJ 40537",TRUE,TRUE
Group think step increase answer know. Agreement question develop. Use far kitchen impact thus moment at. Apt. 212,Address,Apt. 212,Address,Apt. 212,TRUE,TRUE
Candidate economic character present money daughter world 2254280030993205 well. Open analysis center.,CreditCardNumber,2.25428E+15,CreditCardNumber,2.25428E+15,TRUE,TRUE
Film range 30325919279187 sound. People age that.,CreditCardNumber,3.03259E+13,CreditCardNumber,3.03259E+13,TRUE,TRUE
4534678333333995 Back want myself class certain. Tree pretty career environment change letter top.,CreditCardNumber,4.53468E+15,CreditCardNumber,4.53468E+15,TRUE,TRUE
Bring guy hold green girl. 4562690712104207,CreditCardNumber,4.56269E+15,CreditCardNumber,4.56269E+15,TRUE,TRUE
May lay not boy case citizen. Woman executive dog 6557590208608483 pull traditional dinner.,CreditCardNumber,6.55759E+15,CreditCardNumber,6.55759E+15,TRUE,TRUE
Themselves early our 584516367052 bit. Institution peace spring agree ever. Involve do play realize true consumer reality.,CreditCardNumber,5.84516E+11,CreditCardNumber,5.84516E+11,TRUE,TRUE
Career respond front happen decide. History hair least exist sit similar them. Play near near middle natural 2383084986841820 rich.,CreditCardNumber,2.38308E+15,CreditCardNumber,2.38308E+15,TRUE,TRUE
Fine 4993313326896 during five spring page where language. Partner onto fight your treat already best. Professional town media hope newspaper order.,CreditCardNumber,4.99331E+12,CreditCardNumber,4.99331E+12,TRUE,TRUE
Cup item remain environment not. Foot nation key high seek eight. 501809778290,CreditCardNumber,5.0181E+11,CreditCardNumber,5.0181E+11,TRUE,TRUE
Question as should sign face. Memory 348868867045610 approach month back.,CreditCardNumber,3.48869E+14,CreditCardNumber,3.48869E+14,TRUE,TRUE
Sound improve parent dream send language. Hundred better down understand treatment able. Partner kid want feel action 2254280030993205 yeah.,CreditCardNumber,2.25428E+15,CreditCardNumber,2.25428E+15,TRUE,TRUE
We trial win. Indeed hotel dream. Poor friend go east above. 30558499969674,CreditCardNumber,3.05585E+13,CreditCardNumber,3.05585E+13,TRUE,TRUE
6581412495442189 Series painting development simply good. Hour cultural so only group.,CreditCardNumber,6.58141E+15,CreditCardNumber,6.58141E+15,TRUE,TRUE
375660488040203 Gun billion skin. Find success force state within.,CreditCardNumber,3.7566E+14,CreditCardNumber,3.7566E+14,TRUE,TRUE
Wear language word kitchen might figure miss join. 4378647003793439745 Large hear security year during reach watch.,CreditCardNumber,4.37865E+18,CreditCardNumber,4.37865E+18,TRUE,TRUE
Organization rich indicate medical everyone industry. Under word director value. Candidate help anything weight 30102328410277 specific.,CreditCardNumber,3.01023E+13,CreditCardNumber,3.01023E+13,TRUE,TRUE
Job security fall bad good relationship. List area away federal necessary. Wind all stage time 4378647003793439745 animal.,CreditCardNumber,4.37865E+18,CreditCardNumber,4.37865E+18,TRUE,TRUE
Lay case final. East dark week account structure 3577200907612918 red company give.,CreditCardNumber,3.5772E+15,CreditCardNumber,3.5772E+15,TRUE,TRUE
Community stand 676257183670 nice whatever film. Blood go particular same wait record interview. Position sometimes test shoulder save huge course. Almost they himself less interesting education.,CreditCardNumber,6.76257E+11,CreditCardNumber,6.76257E+11,TRUE,TRUE
View consumer our. Kind 4282096422839141 simple support. Operation Democrat off red economic environment human.,CreditCardNumber,4.2821E+15,CreditCardNumber,4.2821E+15,TRUE,TRUE
Soon study though once. Former grow around 180094837534853 morning guy activity.,CreditCardNumber,1.80095E+14,CreditCardNumber,1.80095E+14,TRUE,TRUE
Although foreign national clearly church establish in first. Approach situation hair 3571057486367876 animal team. Across hospital bag.,CreditCardNumber,3.57106E+15,CreditCardNumber,3.57106E+15,TRUE,TRUE
Mission throughout 180001995283371 small save still lay discussion according. Spend man finally finish some officer.,CreditCardNumber,1.80002E+14,CreditCardNumber,1.80002E+14,TRUE,TRUE
Member evening ready. Choose quality 3563330148426475 traditional create town common American.,CreditCardNumber,3.56333E+15,CreditCardNumber,3.56333E+15,TRUE,TRUE
Support do total threat exist material. Here boy move much. Candidate will data agency field care. Page task opportunity door board sound 4534678333333995 ready.,CreditCardNumber,4.53468E+15,CreditCardNumber,4.53468E+15,TRUE,TRUE
Close pressure finally. Young question 4800729495489583 Mrs leg group president.,CreditCardNumber,4.80073E+15,CreditCardNumber,4.80073E+15,TRUE,TRUE
Quality whom pay travel our 4914569109182 table course. Likely other out.,CreditCardNumber,4.91457E+12,CreditCardNumber,4.91457E+12,TRUE,TRUE
Relationship what family state time artist side. Oil second social collection east natural during. Popular lead 3509479106877737 its federal eight I.,CreditCardNumber,3.50948E+15,CreditCardNumber,3.50948E+15,TRUE,TRUE
Everyone road skill act condition heart 38494361631717 real wear. Left song very foreign bed soldier.,CreditCardNumber,3.84944E+13,CreditCardNumber,3.84944E+13,TRUE,TRUE
Fight strategy maintain every 6563716230495464 because religious bed.,CreditCardNumber,6.56372E+15,CreditCardNumber,6.56372E+15,TRUE,TRUE
Most nor 584516367052 star remain.,CreditCardNumber,5.84516E+11,CreditCardNumber,5.84516E+11,TRUE,TRUE
Team Republican him reveal. Player party 4282096422839141 leg beyond.,CreditCardNumber,4.2821E+15,CreditCardNumber,4.2821E+15,TRUE,TRUE
One than light class. Between impact those 30579838131834 cold truth.,CreditCardNumber,3.05798E+13,CreditCardNumber,3.05798E+13,TRUE,TRUE
