Text,Labels,PII,Labels_found,PII_found,Match_Labels,Match_PII
193-MQA Coach he west magazine against beat. By sometimes series time whole election prove. Series protect program may peace answer.,Plates,193-MQA,Plates,193-MQA,TRUE,TRUE
Speech national especially available own black alone. After friend religious unit movement not 132 DXO pretty all.,Plates,132 DXO,Plates,132 DXO,TRUE,TRUE
Forward listen step this community financial most. Deal item all. Subject consider 1K 5G5TIM care training.,Plates,1K 5G5TIM,Plates,1K 5G5TIM,TRUE,TRUE
YIN-3598 Test artist person billion. Trouble staff industry measure sense before.,Plates,YIN-3598,Plates,YIN-3598,TRUE,TRUE
Group LL 61909 think step increase answer know. Agreement question develop. Use far kitchen impact thus moment at.,Plates,LL 61909,Plates,LL 61909,TRUE,TRUE
Candidate economic character present 829 49 9139 money daughter world well. Open analysis center.,SSN,829 49 9139,SSN,829 49 9139,TRUE,TRUE
Film range sound. People 423 72 5067 age that.,SSN,423 72 5067,SSN,423 72 5067,TRUE,TRUE
Back want myself class certain. 033 62 8302 Tree pretty career environment change letter top.,SSN,033 62 8302,SSN,033 62 8302,TRUE,TRUE
Bring 184-79-5724 guy hold green girl.,SSN,184-79-5724,SSN,184-79-5724,TRUE,TRUE
May lay not boy 166-43-2545 case citizen. Woman executive dog pull traditional dinner.,SSN,166-43-2545,SSN,166-43-2545,TRUE,TRUE
Themselves early our bit. Institution 353-25-6266 peace spring agree ever. Involve do play realize true consumer reality.,SSN,353-25-6266,SSN,353-25-6266,TRUE,TRUE
595-23-4635 Career respond front happen decide. History hair least exist sit similar them. Play near near middle natural rich.,SSN,595-23-4635,SSN,595-23-4635,TRUE,TRUE
Fine during five spring page where language. Partner onto fight your treat already best. Professional town 390 30 3140 media hope newspaper order.,SSN,390 30 3140,SSN,390 30 3140,TRUE,TRUE
Cup item remain environment not. Foot nation key 319-69-3108 high seek eight.,SSN,319-69-3108,SSN,319-69-3108,TRUE,TRUE
Question as should sign face. Memory 337-66-8906 approach month back.,SSN,337-66-8906,SSN,337-66-8906,TRUE,TRUE
Sound improve parent dream 377 98 7558 send language. Hundred better down understand treatment able. Partner kid want feel action yeah.,SSN,377 98 7558,SSN,377 98 7558,TRUE,TRUE
We trial win. Indeed hotel 211 72 2423 dream. Poor friend go east above.,SSN,211 72 2423,SSN,211 72 2423,TRUE,TRUE
Series painting development simply 693 88 4776 good. Hour cultural so only group.,SSN,693 88 4776,SSN,693 88 4776,TRUE,TRUE
Gun billion skin. Find success force state 211 72 2423 within.,SSN,211 72 2423,SSN,211 72 2423,TRUE,TRUE
Wear language word kitchen might figure miss join. Large hear security year during reach watch. 211 72 2423,SSN,211 72 2423,SSN,211 72 2423,TRUE,TRUE
Organization 877-42-6395 rich indicate medical everyone industry. Under word director value. Candidate help anything weight specific.,SSN,877-42-6395,SSN,877-42-6395,TRUE,TRUE
Job security fall bad good relationship. List area away federal necessary. 587-05-0700 Wind all stage time animal.,SSN,587-05-0700,SSN,587-05-0700,TRUE,TRUE
287 56 7453 Lay case final. East dark week account structure red company give.,SSN,287 56 7453,SSN,287 56 7453,TRUE,TRUE
Community stand nice whatever film. Blood go particular same wait record interview. Position sometimes test 607-18-5251 shoulder save huge course. Almost they himself less interesting education.,SSN,607-18-5251,SSN,607-18-5251,TRUE,TRUE
View consumer our. Kind simple 380-18-3025 support. Operation Democrat off red economic environment human.,SSN,380-18-3025,SSN,380-18-3025,TRUE,TRUE
Soon study though once. Former grow around 818-43-7502 morning guy activity.,SSN,818-43-7502,SSN,818-43-7502,TRUE,TRUE
Although foreign national clearly church establish in first. Approach situation hair animal team. Across hospital 353-25-6266 bag.,SSN,353-25-6266,SSN,353-25-6266,TRUE,TRUE
Mission throughout small save 587-05-0700 still lay discussion according. Spend man finally finish some officer.,SSN,587-05-0700,SSN,587-05-0700,TRUE,TRUE
Member evening ready. 693 88 4776 Choose quality traditional create town common American.,SSN,693 88 4776,SSN,693 88 4776,TRUE,TRUE
Support do total threat exist material. Here boy move much. Candidate will data agency field care. 524-79-6068 Page task opportunity door board sound ready.,SSN,524-79-6068,SSN,524-79-6068,TRUE,TRUE
Close pressure finally. Young question Mrs leg group 256-03-4832 president.,SSN,256-03-4832,SSN,256-03-4832,TRUE,TRUE
337-66-8906 Quality whom pay travel our table course. Likely other out.,SSN,337-66-8906,SSN,337-66-8906,TRUE,TRUE
Relationship what family state time artist side. 250 54 9613 Oil second social collection east natural during. Popular lead its federal eight I.,SSN,250 54 9613,SSN,250 54 9613,TRUE,TRUE
868-29-9460 Everyone road skill act condition heart real wear. Left song very foreign bed soldier.,SSN,868-29-9460,SSN,868-29-9460,TRUE,TRUE
Fight strategy maintain 654-86-5363 every because religious bed.,SSN,654-86-5363,SSN,654-86-5363,TRUE,TRUE
Most 841-33-6830 nor star remain.,SSN,841-33-6830,SSN,841-33-6830,TRUE,TRUE
Team Republican 841 90 6688 him reveal. Player party leg beyond.,SSN,841 90 6688,SSN,841 90 6688,TRUE,TRUE
One than light class. 353-25-6266 Between impact those cold truth.,SSN,353-25-6266,SSN,353-25-6266,TRUE,TRUE
During technology weight appear gun. Soon claim method. 531-85-6578 Parent between role travel.,SSN,531-85-6578,SSN,531-85-6578,TRUE,TRUE
Room up 423 72 5067 generation free discover grow. Pattern authority effort himself. Avoid lawyer name.,SSN,423 72 5067,SSN,423 72 5067,TRUE,TRUE
Never break about risk. Pay number west economic 719-19-7197 test involve agent boy. Number least seat expert class watch work.,SSN,719-19-7197,SSN,719-19-7197,TRUE,TRUE
Strong whole head name mean. American lose animal well position strategy growth Republican. Common the term ability 711-72-2561 choice Republican last.,SSN,711-72-2561,SSN,711-72-2561,TRUE,TRUE
Ok dream campaign task six only 587-05-0700 Congress. Score account fund various onto will.,SSN,587-05-0700,SSN,587-05-0700,TRUE,TRUE
Town minute culture throughout business. Under stay occur hot. 877-42-6395,SSN,877-42-6395,SSN,877-42-6395,TRUE,TRUE
Radio respond perhaps western loss blood. Turn list economy itself executive indeed with. Final so environmental relationship or arrive idea church. Fast exactly 868-29-9460 raise city push live benefit else.,SSN,868-29-9460,SSN,868-29-9460,TRUE,TRUE
Approach article 638 70 6832 scene though respond white song. Pick PM even white still. Keep north reflect away property standard.,SSN,638 70 6832,SSN,638 70 6832,TRUE,TRUE
Cell town administration arm. Say 629 43 9268 range watch our shoulder as.,SSN,629 43 9268,SSN,629 43 9268,TRUE,TRUE
Goal agent resource office material game. Lot scene help. Answer visit southern situation. Fall country 472-02-4184 win out rather dinner marriage.,SSN,472-02-4184,SSN,472-02-4184,TRUE,TRUE
History effort 427 68 3081 system kitchen. Heart your situation act forget question factor. Evening be white will work debate.,SSN,427 68 3081,SSN,427 68 3081,TRUE,TRUE
Leader any type 161-77-0375 improve first black child. Avoid list political thing. Model during white note various night.,SSN,161-77-0375,SSN,161-77-0375,TRUE,TRUE
Thank realize edge quality agency. Mrs produce manage this people see police. Hospital campaign message create people concern. Order bring alone set 197-61-6953 including.,SSN,197-61-6953,SSN,197-61-6953,TRUE,TRUE
Discover author see president return man last. Black door 264-94-9023 already card increase dog minute. Think approach itself season.,SSN,264-94-9023,SSN,264-94-9023,TRUE,TRUE
Easy have whatever point better. Instead measure game. 680-18-7734,SSN,680-18-7734,SSN,680-18-7734,TRUE,TRUE
Party woman past grow edge. Pretty eat 766-65-9797 Democrat source return party.,SSN,766-65-9797,SSN,766-65-9797,TRUE,TRUE
Series seem sister health. Identify 063-36-1447 company authority seek scene concern. Yes pick father.,SSN,063-36-1447,SSN,063-36-1447,TRUE,TRUE
070 63 6493 Old to health ask figure. Fill when hotel girl yet fill defense service. Someone page successful.,SSN,070 63 6493,SSN,070 63 6493,TRUE,TRUE
Movie statement leader ready ok follow debate. Trouble work article author fish. Radio 472-02-4184 glass individual fact work road though positive.,SSN,472-02-4184,SSN,472-02-4184,TRUE,TRUE
Exist establish we reason job record accept. Western nearly region own view 342-57-8272 protect.,SSN,342-57-8272,SSN,342-57-8272,TRUE,TRUE
First resource test rate. 344 81 3132 Father beat family prove meeting customer. Strategy both ground able light service during.,SSN,344 81 3132,SSN,344 81 3132,TRUE,TRUE
Civil notice 319-69-3108 travel commercial. Consumer itself edge generation wait magazine sister. Hour care help foreign his test.,SSN,319-69-3108,SSN,319-69-3108,TRUE,TRUE
Also six million group reach future. Personal politics performance magazine mention institution relationship. Health present 423 72 5067 true pressure.,SSN,423 72 5067,SSN,423 72 5067,TRUE,TRUE
Program indicate whose attorney five according. Young citizen interview speech nor. Everything five clear left quite 568 44 2324 watch home sound.,SSN,568 44 2324,SSN,568 44 2324,TRUE,TRUE
Such 802-65-0413 today election away. Month color officer room no. Weight night letter care too.,SSN,802-65-0413,SSN,802-65-0413,TRUE,TRUE
Nature American should reduce two. Store goal entire prove sure 693 88 4776 Democrat hope. Dog can computer.,SSN,693 88 4776,SSN,693 88 4776,TRUE,TRUE
Defense region trade hold bed time audience choice. Sell of heart. 070 63 6493 Practice north white off.,SSN,070 63 6493,SSN,070 63 6493,TRUE,TRUE
Still yes everyone section center 595-23-4635 feel. View real late. Test financial success apply.,SSN,595-23-4635,SSN,595-23-4635,TRUE,TRUE
Certainly success training idea 059-97-9743 large. Majority food behind. Project voice alone trouble. Away relationship mother.,SSN,059-97-9743,SSN,059-97-9743,TRUE,TRUE
140-40-0636 Around well meet whose five before. Some or most add. Want option meeting say.,SSN,140-40-0636,SSN,140-40-0636,TRUE,TRUE
Federal nice this idea sell. If somebody watch without best. 059-97-9743,SSN,059-97-9743,SSN,059-97-9743,TRUE,TRUE
Year not 719-19-7197 special must run since. Stuff their better of public good.,SSN,719-19-7197,SSN,719-19-7197,TRUE,TRUE
Add three Democrat deep bill appear. Or box traditional majority. 877-42-6395 Analysis fly teacher court like president.,SSN,877-42-6395,SSN,877-42-6395,TRUE,TRUE
Feel thank whether threat spring third position. Away 820-56-4229 magazine whatever source answer ability. Election shoulder like student peace.,SSN,820-56-4229,SSN,820-56-4229,TRUE,TRUE
She late away line recent employee. 161-77-0375 Several past personal.,SSN,161-77-0375,SSN,161-77-0375,TRUE,TRUE
Nearly but foreign. Much value beat second poor feeling work. 427 68 3081 Then picture them water window.,SSN,427 68 3081,SSN,427 68 3081,TRUE,TRUE
Character 896-11-9761 film whole above operation player cause.,SSN,896-11-9761,SSN,896-11-9761,TRUE,TRUE
Drop yet bad each whose. Machine board 345-28-2669 size special care hear.,SSN,345-28-2669,SSN,345-28-2669,TRUE,TRUE
711-72-2561 Road audience large this. Future artist condition cut. Recent still a trip fine. Thought again ever price shake relate.,SSN,711-72-2561,SSN,711-72-2561,TRUE,TRUE
Upon some challenge Democrat perhaps. 719-19-7197 Way beat institution another decide behavior agent.,SSN,719-19-7197,SSN,719-19-7197,TRUE,TRUE
Again 161-77-0375 while skill difficult responsibility. Hard woman final. But still system top.,SSN,161-77-0375,SSN,161-77-0375,TRUE,TRUE
Try arrive vote moment recognize. 667 54 4065 Compare ever over house list quickly.,SSN,667 54 4065,SSN,667 54 4065,TRUE,TRUE
Network article for eight same. Receive meet service 638 70 6832 true other. Law already people add style paper eye.,SSN,638 70 6832,SSN,638 70 6832,TRUE,TRUE
Any information garden to citizen 531-85-6578 movie hear authority. Full control method debate project product list. Fall public individual action imagine agent.,SSN,531-85-6578,SSN,531-85-6578,TRUE,TRUE
Same likely fear detail clearly. And song find power toward sometimes 197-61-6953 leader. Family coach like outside price financial.,SSN,197-61-6953,SSN,197-61-6953,TRUE,TRUE
Break light base sea. Magazine decide crime government wrong half consider. Herself decide produce its 070 63 6493 against off many exist.,SSN,070 63 6493,SSN,070 63 6493,TRUE,TRUE
Effect 874 23 8332 born weight democratic official agreement. Glass hear artist not teacher.,SSN,874 23 8332,SSN,874 23 8332,TRUE,TRUE
Talk while American suddenly 587-05-0700 participant second account. Anything whole ok car store tough want manager.,SSN,587-05-0700,SSN,587-05-0700,TRUE,TRUE
Camera wall continue top us clearly hot including. 896-11-9761,SSN,896-11-9761,SSN,896-11-9761,TRUE,TRUE
Course college still loss scene. Series 530 12 8752 many speech law film.,SSN,530 12 8752,SSN,530 12 8752,TRUE,TRUE
243 53 6315 Movement near value number able ability result table.,SSN,243 53 6315,SSN,243 53 6315,TRUE,TRUE
Pull key other nor 166-43-2545 save perform. List service ready yard clearly.,SSN,166-43-2545,SSN,166-43-2545,TRUE,TRUE
Ready off score foot market protect. 829 49 9139,SSN,829 49 9139,SSN,829 49 9139,TRUE,TRUE
Up course education involve thousand. Treat scientist actually study avoid education. 211 72 2423 Floor out language laugh tough rule investment.,SSN,211 72 2423,SSN,211 72 2423,TRUE,TRUE
Huge develop environmental president their. Manage could outside professional power question this. Point learn tonight again 423 72 5067 whom true rate.,SSN,423 72 5067,SSN,423 72 5067,TRUE,TRUE
Possible both develop 595-23-4635 claim. Call than message simple class.,SSN,595-23-4635,SSN,595-23-4635,TRUE,TRUE
Describe question cover suggest 344 81 3132 actually with. Course fly hope require she. Season real keep each sign fly. Common take compare force.,SSN,344 81 3132,SSN,344 81 3132,TRUE,TRUE
Per learn agree despite smile him foot. Wait should effect 877-42-6395 from. Close make result. Fish strong which force next teach newspaper.,SSN,877-42-6395,SSN,877-42-6395,TRUE,TRUE
766-65-9797 Director thousand manager give board white. Result how more southern. Fact guess to.,SSN,766-65-9797,SSN,766-65-9797,TRUE,TRUE
Report author 319-69-3108 increase a receive watch. Book rather imagine. Decision hit result able store future development source.,SSN,319-69-3108,SSN,319-69-3108,TRUE,TRUE
Positive cause I arrive night site wind. Throughout mind over he collection 319-69-3108 hit. Fall challenge action through.,SSN,319-69-3108,SSN,319-69-3108,TRUE,TRUE
Store effort campaign girl worker technology. Fact reach somebody sense. Run run tonight soldier. World trade play account 377 98 7558 up single.,SSN,377 98 7558,SSN,377 98 7558,TRUE,TRUE
Coach he west magazine against 510-81-5182 beat. By sometimes series time whole election prove. Series protect program may peace answer.,SSN,510-81-5182,SSN,510-81-5182,TRUE,TRUE
Speech national especially 471 33 3655 available own black alone. After friend religious unit movement not pretty all.,SSN,471 33 3655,SSN,471 33 3655,TRUE,TRUE
Forward listen step this community financial most. Deal 008-52-3159 item all. Subject consider care training.,SSN,008-52-3159,SSN,008-52-3159,TRUE,TRUE
Test artist person billion. Trouble staff industry measure sense 818-43-7502 before.,SSN,818-43-7502,SSN,818-43-7502,TRUE,TRUE
Group think step increase 587-05-0700 answer know. Agreement question develop. Use far kitchen impact thus moment at.,SSN,587-05-0700,SSN,587-05-0700,TRUE,TRUE
Candidate economic character present money daughter world well. Open analysis center.,None,None,None,None,TRUE,TRUE
Film range sound. People age that.,None,None,None,None,TRUE,TRUE
Back want myself class certain. Tree pretty career environment change letter top.,None,None,None,None,TRUE,TRUE
Bring guy hold green girl.,None,None,None,None,TRUE,TRUE
May lay not boy case citizen. Woman executive dog pull traditional dinner.,None,None,None,None,TRUE,TRUE
Themselves early our bit. Institution peace spring agree ever. Involve do play realize true consumer reality.,None,None,None,None,TRUE,TRUE
Career respond front happen decide. History hair least exist sit similar them. Play near near middle natural rich.,None,None,None,None,TRUE,TRUE
Fine during five spring page where language. Partner onto fight your treat already best. Professional town media hope newspaper order.,None,None,None,None,TRUE,TRUE
Cup item remain environment not. Foot nation key high seek eight.,None,None,None,None,TRUE,TRUE
Question as should sign face. Memory approach month back.,None,None,None,None,TRUE,TRUE
Sound improve parent dream send language. Hundred better down understand treatment able. Partner kid want feel action yeah.,None,None,None,None,TRUE,TRUE
We trial win. Indeed hotel dream. Poor friend go east above.,None,None,None,None,TRUE,TRUE
Series painting development simply good. Hour cultural so only group.,None,None,None,None,TRUE,TRUE
Gun billion skin. Find success force state within.,None,None,None,None,TRUE,TRUE
Wear language word kitchen might figure miss join. Large hear security year during reach watch.,None,None,None,None,TRUE,TRUE
Organization rich indicate medical everyone industry. Under word director value. Candidate help anything weight specific.,None,None,None,None,TRUE,TRUE
Job security fall bad good relationship. List area away federal necessary. Wind all stage time animal.,None,None,None,None,TRUE,TRUE
Lay case final. East dark week account structure red company give.,None,None,None,None,TRUE,TRUE
Community stand nice whatever film. Blood go particular same wait record interview. Position sometimes test shoulder save huge course. Almost they himself less interesting education.,None,None,None,None,TRUE,TRUE
View consumer our. Kind simple support. Operation Democrat off red economic environment human.,None,None,None,None,TRUE,TRUE
Soon study though once. Former grow around morning guy activity.,None,None,None,None,TRUE,TRUE
Although foreign national clearly church establish in first. Approach situation hair animal team. Across hospital bag.,None,None,None,None,TRUE,TRUE
Mission throughout small save still lay discussion according. Spend man finally finish some officer.,None,None,None,None,TRUE,TRUE
Member evening ready. Choose quality traditional create town common American.,None,None,None,None,TRUE,TRUE
Support do total threat exist material. Here boy move much. Candidate will data agency field care. Page task opportunity door board sound ready.,None,None,None,None,TRUE,TRUE
Close pressure finally. Young question Mrs leg group president.,None,None,Name,,FALSE,FALSE
Quality whom pay travel our table course. Likely other out.,None,None,None,None,TRUE,TRUE
Relationship what family state time artist side. Oil second social collection east natural during. Popular lead its federal eight I.,None,None,None,None,TRUE,TRUE
Everyone road skill act condition heart real wear. Left song very foreign bed soldier.,None,None,None,None,TRUE,TRUE
Fight strategy maintain every because religious bed.,None,None,None,None,TRUE,TRUE
Most nor star remain.,None,None,None,None,TRUE,TRUE
Team Republican him reveal. Player party leg beyond.,None,None,None,None,TRUE,TRUE
One than light class. Between impact those cold truth.,None,None,None,None,TRUE,TRUE
During technology weight appear gun. Soon claim method. Parent between role travel.,None,None,None,None,TRUE,TRUE
Room up generation free discover grow. Pattern authority effort himself. Avoid lawyer name.,None,None,None,None,TRUE,TRUE
Never break about risk. Pay number west economic test involve agent boy. Number least seat expert class watch work.,None,None,None,None,TRUE,TRUE
Strong whole head name mean. American lose animal well position strategy growth Republican. Common the term ability choice Republican last.,None,None,None,None,TRUE,TRUE
Ok dream campaign task six only Congress. Score account fund various onto will.,None,None,None,None,TRUE,TRUE
Town minute culture throughout business. Under stay occur hot.,None,None,None,None,TRUE,TRUE
Radio respond perhaps western loss blood. Turn list economy itself executive indeed with. Final so environmental relationship or arrive idea church. Fast exactly raise city push live benefit else.,None,None,None,None,TRUE,TRUE
Approach article scene though respond white song. Pick PM even white still. Keep north reflect away property standard.,None,None,None,None,TRUE,TRUE
Cell town administration arm. Say range watch our shoulder as.,None,None,None,None,TRUE,TRUE
Goal agent resource office material game. Lot scene help. Answer visit southern situation. Fall country win out rather dinner marriage.,None,None,None,None,TRUE,TRUE
History effort system kitchen. Heart your situation act forget question factor. Evening be white will work debate.,None,None,None,None,TRUE,TRUE
Leader any type improve first black child. Avoid list political thing. Model during white note various night.,None,None,None,None,TRUE,TRUE
Thank realize edge quality agency. Mrs produce manage this people see police. Hospital campaign message create people concern. Order bring alone set including.,None,None,None,None,TRUE,TRUE
Discover author see president return man last. Black door already card increase dog minute. Think approach itself season.,None,None,None,None,TRUE,TRUE
Easy have whatever point better. Instead measure game.,None,None,None,None,TRUE,TRUE
Party woman past grow edge. Pretty eat Democrat source return party.,None,None,None,None,TRUE,TRUE
Series seem sister health. Identify company authority seek scene concern. Yes pick father.,None,None,None,None,TRUE,TRUE
Old to health ask figure. Fill when hotel girl yet fill defense service. Someone page successful.,None,None,None,None,TRUE,TRUE
Movie statement leader ready ok follow debate. Trouble work article author fish. Radio glass individual fact work road though positive.,None,None,None,None,TRUE,TRUE
Exist establish we reason job record accept. Western nearly region own view protect.,None,None,None,None,TRUE,TRUE
First resource test rate. Father beat family prove meeting customer. Strategy both ground able light service during.,None,None,None,None,TRUE,TRUE
Civil notice travel commercial. Consumer itself edge generation wait magazine sister. Hour care help foreign his test.,None,None,None,None,TRUE,TRUE
Also six million group reach future. Personal politics performance magazine mention institution relationship. Health present true pressure.,None,None,None,None,TRUE,TRUE
Program indicate whose attorney five according. Young citizen interview speech nor. Everything five clear left quite watch home sound.,None,None,None,None,TRUE,TRUE
Such today election away. Month color officer room no. Weight night letter care too.,None,None,None,None,TRUE,TRUE
Nature American should reduce two. Store goal entire prove sure Democrat hope. Dog can computer.,None,None,None,None,TRUE,TRUE
Defense region trade hold bed time audience choice. Sell of heart. Practice north white off.,None,None,None,None,TRUE,TRUE
Still yes everyone section center feel. View real late. Test financial success apply.,None,None,None,None,TRUE,TRUE
Certainly success training idea large. Majority food behind. Project voice alone trouble. Away relationship mother.,None,None,None,None,TRUE,TRUE
Around well meet whose five before. Some or most add. Want option meeting say.,None,None,None,None,TRUE,TRUE
Federal nice this idea sell. If somebody watch without best.,None,None,None,None,TRUE,TRUE
Year not special must run since. Stuff their better of public good.,None,None,None,None,TRUE,TRUE
Add three Democrat deep bill appear. Or box traditional majority. Analysis fly teacher court like president.,None,None,None,None,TRUE,TRUE
Feel thank whether threat spring third position. Away magazine whatever source answer ability. Election shoulder like student peace.,None,None,None,None,TRUE,TRUE
She late away line recent employee. Several past personal.,None,None,None,None,TRUE,TRUE
Nearly but foreign. Much value beat second poor feeling work. Then picture them water window.,None,None,None,None,TRUE,TRUE
Character film whole above operation player cause.,None,None,None,None,TRUE,TRUE
Drop yet bad each whose. Machine board size special care hear.,None,None,None,None,TRUE,TRUE
Road audience large this. Future artist condition cut. Recent still a trip fine. Thought again ever price shake relate.,None,None,None,None,TRUE,TRUE
Upon some challenge Democrat perhaps. Way beat institution another decide behavior agent.,None,None,None,None,TRUE,TRUE
Again while skill difficult responsibility. Hard woman final. But still system top.,None,None,None,None,TRUE,TRUE
Try arrive vote moment recognize. Compare ever over house list quickly.,None,None,None,None,TRUE,TRUE
Network article for eight same. Receive meet service true other. Law already people add style paper eye.,None,None,None,None,TRUE,TRUE
Any information garden to citizen movie hear authority. Full control method debate project product list. Fall public individual action imagine agent.,None,None,None,None,TRUE,TRUE
Same likely fear detail clearly. And song find power toward sometimes leader. Family coach like outside price financial.,None,None,None,None,TRUE,TRUE
Break light base sea. Magazine decide crime government wrong half consider. Herself decide produce its against off many exist.,None,None,None,None,TRUE,TRUE
Effect born weight democratic official agreement. Glass hear artist not teacher.,None,None,None,None,TRUE,TRUE
