Text,Labels,PII,Labels_found,PII_found,Match_Labels,Match_PII
shawnconner@yates.com Upon some challenge Democrat perhaps. Way beat institution another decide behavior agent.,Email,shawnconner@yates.com,Email,shawnconner@yates.com,TRUE,TRUE
Again while skill difficult responsibility. Hard woman final. But still johnsontracey@gmail.com system top.,Email,johnsontracey@gmail.com,Email,johnsontracey@gmail.com,TRUE,TRUE
Try arrive vote moment recognize. Compare coopermichael@olson.com ever over house list quickly.,Email,coopermichael@olson.com,Email,coopermichael@olson.com,TRUE,TRUE
Network article for eight same. Receive meet service true other. Law macknicole@gmail.com already people add style paper eye.,Email,macknicole@gmail.com,Email,macknicole@gmail.com,TRUE,TRUE
acrawford@barrett.com Any information garden to citizen movie hear authority. Full control method debate project product list. Fall public individual action imagine agent.,Email,acrawford@barrett.com,Email,acrawford@barrett.com,TRUE,TRUE
Same likely fear detail clearly. And song find power toward sometimes leader. Family coach like outside jrodriguez@mccarthy-lawson.biz price financial.,Email,jrodriguez@mccarthy-lawson.biz,Email,jrodriguez@mccarthy-lawson.biz,TRUE,TRUE
Break light base sea. Magazine decide whoward@hansen.com crime government wrong half consider. Herself decide produce its against off many exist.,Email,whoward@hansen.com,Email,whoward@hansen.com,TRUE,TRUE
Effect born weight democratic johnsontracey@gmail.com official agreement. Glass hear artist not teacher.,Email,johnsontracey@gmail.com,Email,johnsontracey@gmail.com,TRUE,TRUE
Talk while American suddenly participant second account. Anything williamsonjoshua@robinson.com whole ok car store tough want manager.,Email,williamsonjoshua@robinson.com,Email,williamsonjoshua@robinson.com,TRUE,TRUE
Camera wall continue top us clearly hot kennethallen@turner.com including.,Email,kennethallen@turner.com,Email,kennethallen@turner.com,TRUE,TRUE
Course college still loss scene. Series robertmullins@yahoo.com many speech law film.,Email,robertmullins@yahoo.com,Email,robertmullins@yahoo.com,TRUE,TRUE
Movement near heathergibson@miller.com value number able ability result table.,Email,heathergibson@miller.com,Email,heathergibson@miller.com,TRUE,TRUE
Pull key other nor reneebooth@neal.com save perform. List service ready yard clearly.,Email,reneebooth@neal.com,Email,reneebooth@neal.com,TRUE,TRUE
Ready tina46@thomas-boyd.info off score foot market protect.,Email,tina46@thomas-boyd.info,Email,tina46@thomas-boyd.info,TRUE,TRUE
Up course education involve thousand. john95@yahoo.com Treat scientist actually study avoid education. Floor out language laugh tough rule investment.,Email,john95@yahoo.com,Email,john95@yahoo.com,TRUE,TRUE
Huge develop environmental president their. Manage could outside professional power question this. Point learn tonight again whom shawnconner@yates.com true rate.,Email,shawnconner@yates.com,Email,shawnconner@yates.com,TRUE,TRUE
Possible friley@zavala-griffith.com both develop claim. Call than message simple class.,Email,friley@zavala-griffith.com,Email,friley@zavala-griffith.com,TRUE,TRUE
Describe question cover suggest actually with. Course fly hope require she. Season real keep johnsontracey@gmail.com each sign fly. Common take compare force.,Email,johnsontracey@gmail.com,Email,johnsontracey@gmail.com,TRUE,TRUE
Per learn rrice@yahoo.com agree despite smile him foot. Wait should effect from. Close make result. Fish strong which force next teach newspaper.,Email,rrice@yahoo.com,Email,rrice@yahoo.com,TRUE,TRUE
Director thousand manager give board white. melanie28@gmail.com Result how more southern. Fact guess to.,Email,melanie28@gmail.com,Email,melanie28@gmail.com,TRUE,TRUE
Report author increase a receive watch. Book rather imagine. Decision hit result able store future owilson@pineda.net development source.,Email,owilson@pineda.net,Email,owilson@pineda.net,TRUE,TRUE
Positive cause I arrive night site wind. Throughout lwilliams@yahoo.com mind over he collection hit. Fall challenge action through.,Email,lwilliams@yahoo.com,Email,lwilliams@yahoo.com,TRUE,TRUE
Store effort campaign girl worker technology. Fact reach somebody sense. Run run tonight soldier. World trade play account timothycraig@payne.info up single.,Email,timothycraig@payne.info,Email,timothycraig@payne.info,TRUE,TRUE
Coach he west magazine against beat. By sometimes series time whole election prove. acrawford@barrett.com Series protect program may peace answer.,Email,acrawford@barrett.com,Email,acrawford@barrett.com,TRUE,TRUE
imiller@gmail.com Speech national especially available own black alone. After friend religious unit movement not pretty all.,Email,imiller@gmail.com,Email,imiller@gmail.com,TRUE,TRUE
Forward listen step johnsonjoseph@hayden.info this community financial most. Deal item all. Subject consider care training.,Email,johnsonjoseph@hayden.info,Email,johnsonjoseph@hayden.info,TRUE,TRUE
Test artist person billion. sherri68@gmail.com Trouble staff industry measure sense before.,Email,sherri68@gmail.com,Email,sherri68@gmail.com,TRUE,TRUE
Group think step increase answer know. Agreement question develop. Use far kitchen reynoldslauren@shea.biz impact thus moment at.,Email,reynoldslauren@shea.biz,Email,reynoldslauren@shea.biz,TRUE,TRUE
Candidate economic character present money Michael daughter world well. Open analysis center.,Name,Michael,Name,Michael,TRUE,TRUE
Film range sound. People age Christina that.,Name,Christina,Name,,FALSE,FALSE
Back want myself class certain. Tree pretty career environment Melissa change letter top.,Name,Melissa,Name,Melissa,TRUE,TRUE
Bring guy hold green girl. Kane,Name,Kane,Name,Kane,TRUE,TRUE
May lay not boy case citizen. Woman executive dog pull traditional Mendoza dinner.,Name,Mendoza,Name,Mendoza,TRUE,TRUE
Themselves early our bit. Institution peace spring agree ever. Involve Kevin do play realize true consumer reality.,Name,Kevin,Name,Kevin,TRUE,TRUE
Career respond front happen decide. History hair least exist sit similar James Wilson them. Play near near middle natural rich.,Name,James Wilson,Name,James Wilson,TRUE,TRUE
Fine during five Henry spring page where language. Partner onto fight your treat already best. Professional town media hope newspaper order.,Name,Henry,Name,Henry,TRUE,TRUE
Craig Rose Cup item remain environment not. Foot nation key high seek eight.,Name,Craig Rose,Name,Craig Rose,TRUE,TRUE
Question as should sign face. Memory Christina Smith approach month back.,Name,Christina Smith,Name,Christina Smith,TRUE,TRUE
Sound improve parent dream send language. Hundred better down understand treatment able. Partner Higgins kid want feel action yeah.,Name,Higgins,Name,Higgins,TRUE,TRUE
We trial Christina Smith win. Indeed hotel dream. Poor friend go east above.,Name,Christina Smith,Name,Christina Smith,TRUE,TRUE
Series painting Anthony Davis development simply good. Hour cultural so only group.,Name,Anthony Davis,Name,Anthony Davis,TRUE,TRUE
Gun billion skin. Find success Lindsay force state within.,Name,Lindsay,Name,Lindsay,TRUE,TRUE
Wear language word kitchen might figure miss join. Large hear security year during reach watch. Gonzalez,Name,Gonzalez,Name,Gonzalez,TRUE,TRUE
Aaron Cole Organization rich indicate medical everyone industry. Under word director value. Candidate help anything weight specific.,Name,Aaron Cole,Name,Aaron Cole,TRUE,TRUE
Job security fall Keller bad good relationship. List area away federal necessary. Wind all stage time animal.,Name,Keller,Name,,FALSE,FALSE
Lay case final. East Sandy dark week account structure red company give.,Name,Sandy,Name,Sandy,TRUE,TRUE
Community stand nice whatever film. Blood go particular same wait record interview. Position sometimes Nelson test shoulder save huge course. Almost they himself less interesting education.,Name,Nelson,Name,Nelson,TRUE,TRUE
View consumer our. Kind simple support. Operation Democrat off red economic environment Mark Lee human.,Name,Mark Lee,Name,Mark Lee,TRUE,TRUE
Craig Soon study though once. Former grow around morning guy activity.,Name,Craig,Name,Craig,TRUE,TRUE
Although foreign national clearly church establish in first. Approach situation hair animal team. Keller Across hospital bag.,Name,Keller,Name,Keller,TRUE,TRUE
Mission throughout small save still Steven lay discussion according. Spend man finally finish some officer.,Name,Steven,Name,Steven,TRUE,TRUE
Member Michael evening ready. Choose quality traditional create town common American.,Name,Michael,Name,Michael,TRUE,TRUE
Support do total threat exist material. Here Craig boy move much. Candidate will data agency field care. Page task opportunity door board sound ready.,Name,Craig,Name,Craig,TRUE,TRUE
Close pressure finally. Young question Mrs leg Lozano group president.,Name,Lozano,Name,,FALSE,FALSE
Quality whom pay Michael Rice travel our table course. Likely other out.,Name,Michael Rice,Name,Michael Rice,TRUE,TRUE
Relationship what family state time artist side. Oil second social collection east Joseph Lewis natural during. Popular lead its federal eight I.,Name,Joseph Lewis,Name,Joseph Lewis,TRUE,TRUE
Everyone road skill act condition heart real wear. Kevin Left song very foreign bed soldier.,Name,Kevin,Name,Kevin,TRUE,TRUE
Fight strategy maintain every because religious bed. Christina,Name,Christina,Name,Christina,TRUE,TRUE
Most nor star Monica Abbott remain.,Name,Monica Abbott,Name,Monica Abbott,TRUE,TRUE
Team Republican him Jessica Ellis reveal. Player party leg beyond.,Name,Jessica Ellis,Name,Jessica Ellis,TRUE,TRUE
One than Edwin Novak light class. Between impact those cold truth.,Name,Edwin Novak,Name,Edwin Novak,TRUE,TRUE
During technology weight appear gun. Soon claim method. Parent Luis Jones between role travel.,Name,Luis Jones,Name,Luis Jones,TRUE,TRUE
Room up generation free discover grow. Pattern authority effort himself. Mary Miller Avoid lawyer name.,Name,Mary Miller,Name,Mary Miller,TRUE,TRUE
Never break about risk. Pay Eric number west economic test involve agent boy. Number least seat expert class watch work.,Name,Eric,Name,Eric,TRUE,TRUE
Strong whole head Barbara Evans name mean. American lose animal well position strategy growth Republican. Common the term ability choice Republican last.,Name,Barbara Evans,Name,Barbara Evans,TRUE,TRUE
Ok dream campaign task six only Congress. Score Kristen account fund various onto will.,Name,Kristen,Name,Kristen,TRUE,TRUE
Town minute culture throughout business. Under stay occur Anthony Davis hot.,Name,Anthony Davis,Name,Anthony Davis,TRUE,TRUE
Radio respond perhaps western loss blood. Turn list economy itself executive indeed with. Final so environmental relationship or arrive idea Jeff Mason church. Fast exactly raise city push live benefit else.,Name,Jeff Mason,Name,Jeff Mason,TRUE,TRUE
Approach article scene though respond white song. Pick PM even white still. Keep north Christina reflect away property standard.,Name,Christina,Name,Christina,TRUE,TRUE
Cell town administration arm. Say range watch our Gonzalez shoulder as.,Name,Gonzalez,Name,Gonzalez,TRUE,TRUE
Goal agent resource office material game. Lot scene help. Answer visit Nelson southern situation. Fall country win out rather dinner marriage.,Name,Nelson,Name,Nelson,TRUE,TRUE
History effort system kitchen. Heart your situation act forget question Anderson factor. Evening be white will work debate.,Name,Anderson,Name,Anderson,TRUE,TRUE
Leader any type improve first black child. Avoid list political thing. Stacy Lee Model during white note various night.,Name,Stacy Lee,Name,Stacy Lee,TRUE,TRUE
Thank realize edge quality Tracy agency. Mrs produce manage this people see police. Hospital campaign message create people concern. Order bring alone set including.,Name,Tracy,Name,Tracy,TRUE,TRUE
Discover author see president return man last. Black door Stacy Lee already card increase dog minute. Think approach itself season.,Name,Stacy Lee,Name,Stacy Lee,TRUE,TRUE
Easy have Michael Reed whatever point better. Instead measure game.,Name,Michael Reed,Name,Michael Reed,TRUE,TRUE
Party woman past grow edge. Pretty eat Democrat source return party. Wilson,Name,Wilson,Name,Wilson,TRUE,TRUE
Series seem Jeff Mason sister health. Identify company authority seek scene concern. Yes pick father.,Name,Jeff Mason,Name,Jeff Mason,TRUE,TRUE
Old to health ask figure. William Madden MD Fill when hotel girl yet fill defense service. Someone page successful.,Name,William Madden MD,Name,William Madden MD,TRUE,TRUE
Movie statement leader ready ok follow Parks debate. Trouble work article author fish. Radio glass individual fact work road though positive.,Name,Parks,Name,Parks,TRUE,TRUE
Exist establish Herrera we reason job record accept. Western nearly region own view protect.,Name,Herrera,Name,Herrera,TRUE,TRUE
First resource test rate. Father beat family prove meeting customer. Strategy both ground able light service during. Brittney Morgan,Name,Brittney Morgan,Name,Brittney Morgan,TRUE,TRUE
Civil notice travel commercial. Consumer itself edge generation wait magazine sister. Hour care help foreign his Joseph Lewis test.,Name,Joseph Lewis,Name,Joseph Lewis,TRUE,TRUE
Also six million group reach future. Personal politics performance magazine mention institution relationship. Health present true pressure. Suarez,Name,Suarez,Name,Suarez,TRUE,TRUE
Program indicate Henry whose attorney five according. Young citizen interview speech nor. Everything five clear left quite watch home sound.,Name,Henry,Name,Henry,TRUE,TRUE
Such today election away. Melissa Month color officer room no. Weight night letter care too.,Name,Melissa,Name,Melissa,TRUE,TRUE
Nature American should reduce two. Store goal Fischer entire prove sure Democrat hope. Dog can computer.,Name,Fischer,None,None,FALSE,FALSE
Eric Defense region trade hold bed time audience choice. Sell of heart. Practice north white off.,Name,Eric,Name,Eric,TRUE,TRUE
Still Alison yes everyone section center feel. View real late. Test financial success apply.,Name,Alison,Name,Alison,TRUE,TRUE
Certainly success training idea large. Majority food behind. Project voice Barbara Evans alone trouble. Away relationship mother.,Name,Barbara Evans,Name,Barbara Evans,TRUE,TRUE
Around well meet whose five before. Some or most Christina Smith add. Want option meeting say.,Name,Christina Smith,Name,Christina Smith,TRUE,TRUE
Federal nice this idea sell. If somebody Edwin Novak watch without best.,Name,Edwin Novak,Name,Edwin Novak,TRUE,TRUE
Year not special must run since. Stuff their better of Robert Lane public good.,Name,Robert Lane,Name,Robert Lane,TRUE,TRUE
Add three Democrat deep bill appear. Or box traditional majority. Analysis fly Stefanie teacher court like president.,Name,Stefanie,None,None,FALSE,FALSE
Rogers Feel thank whether threat spring third position. Away magazine whatever source answer ability. Election shoulder like student peace.,Name,Rogers,Name,Rogers,TRUE,TRUE
She late away line recent Amber Myers employee. Several past personal.,Name,Amber Myers,Name,Amber Myers,TRUE,TRUE
Nearly but foreign. Much value beat second poor feeling work. Then picture them water Christina Smith window.,Name,Christina Smith,Name,Christina Smith,TRUE,TRUE
Character film whole above Anna operation player cause.,Name,Anna,Name,Anna,TRUE,TRUE
Drop yet bad each whose. Machine board size special care Rogers hear.,Name,Rogers,Name,Rogers,TRUE,TRUE
Road audience large this. Future artist condition cut. Recent still a trip fine. Thought again ever price shake relate. Monica Abbott,Name,Monica Abbott,Name,Monica Abbott,TRUE,TRUE
Upon some challenge Democrat perhaps. Craig Way beat institution another decide behavior agent.,Name,Craig,Name,Craig,TRUE,TRUE
Again while skill difficult responsibility. Hard woman final. But still system Colleen Andrews top.,Name,Colleen Andrews,Name,Colleen Andrews,TRUE,TRUE
Perry Try arrive vote moment recognize. Compare ever over house list quickly.,Name,Perry,Name,Perry,TRUE,TRUE
Alison Network article for eight same. Receive meet service true other. Law already people add style paper eye.,Name,Alison,Name,Alison,TRUE,TRUE
Any information garden to citizen movie hear authority. Full control method debate project product list. Fall Henry public individual action imagine agent.,Name,Henry,Name,,FALSE,FALSE
Same likely fear detail clearly. Moss And song find power toward sometimes leader. Family coach like outside price financial.,Name,Moss,Name,Moss,TRUE,TRUE
Break light base sea. Magazine decide crime government wrong half consider. Herself decide produce Henry its against off many exist.,Name,Henry,Name,Henry,TRUE,TRUE
Effect born weight Mark Lee democratic official agreement. Glass hear artist not teacher.,Name,Mark Lee,Name,Mark Lee,TRUE,TRUE
Talk while American suddenly participant second Christina account. Anything whole ok car store tough want manager.,Name,Christina,Name,Christina,TRUE,TRUE
Camera wall continue top us clearly hot including. Darius Lewis,Name,Darius Lewis,Name,Darius Lewis,TRUE,TRUE
Course college Guzman still loss scene. Series many speech law film.,Name,Guzman,Name,Guzman,TRUE,TRUE
Movement near value number able ability result White table.,Name,White,Name,,FALSE,FALSE
Pull key other nor Horn save perform. List service ready yard clearly.,Name,Horn,None,None,FALSE,FALSE
White Ready off score foot market protect.,Name,White,None,None,FALSE,FALSE
Up course education involve thousand. Treat scientist Escobar actually study avoid education. Floor out language laugh tough rule investment.,Name,Escobar,Name,,FALSE,FALSE
Jeff Mason Huge develop environmental president their. Manage could outside professional power question this. Point learn tonight again whom true rate.,Name,Jeff Mason,Name,Jeff Mason,TRUE,TRUE
Possible both develop claim. Call than message Scott simple class.,Name,Scott,Name,Scott,TRUE,TRUE
Describe Emma Miller question cover suggest actually with. Course fly hope require she. Season real keep each sign fly. Common take compare force.,Name,Emma Miller,Name,Emma Miller,TRUE,TRUE
Per learn agree despite smile him foot. Wait should effect from. Close make result. Fish strong which force next teach Garrett Powers newspaper.,Name,Garrett Powers,Name,Garrett Powers,TRUE,TRUE
Director thousand manager give board white. Manning Result how more southern. Fact guess to.,Name,Manning,Name,,FALSE,FALSE
Report author increase a receive watch. Book rather imagine. Decision hit result able store future development Eric source.,Name,Eric,Name,Eric,TRUE,TRUE
Positive cause I arrive night site wind. Throughout mind over he collection Guzman hit. Fall challenge action through.,Name,Guzman,Name,,FALSE,FALSE
Store effort campaign girl worker technology. Fact reach somebody sense. Craig Run run tonight soldier. World trade play account up single.,Name,Craig,Name,Craig,TRUE,TRUE
Coach he west magazine against beat. By sometimes Christina Hill series time whole election prove. Series protect program may peace answer.,Name,Christina Hill,Name,Christina Hill,TRUE,TRUE
Speech national especially available own black alone. After friend religious unit movement not pretty all. Christina,Name,Christina,Name,Christina,TRUE,TRUE
Forward Tracy listen step this community financial most. Deal item all. Subject consider care training.,Name,Tracy,Name,Tracy,TRUE,TRUE
Test artist person billion. Trouble staff industry measure sense Ann Clayton before.,Name,Ann Clayton,Name,Ann Clayton,TRUE,TRUE
Group think step increase answer know. Agreement question Moore develop. Use far kitchen impact thus moment at.,Name,Moore,Name,Moore,TRUE,TRUE
Candidate economic character present money daughter world 996-294-4022 well. Open analysis center.,Phone_number,996-294-4022,Phone_number,996-294-4022,TRUE,TRUE
Film (670)057-5394 range sound. People age that.,Phone_number,(670)057-5394,Phone_number,(670)057-5394,TRUE,TRUE
Back want myself class certain. 070.989.9736x436 Tree pretty career environment change letter top.,Phone_number,070.989.9736x436,Phone_number,070.989.9736x436,TRUE,TRUE
Bring guy (994)673-5721x401 hold green girl.,Phone_number,(994)673-5721x401,Phone_number,(994)673-5721x401,TRUE,TRUE
May lay not boy case citizen. 734.295.9400x4300 Woman executive dog pull traditional dinner.,Phone_number,734.295.9400x4300,Phone_number,734.295.9400x4300,TRUE,TRUE
Themselves early our bit. Institution peace spring agree ever. Involve do play realize true 001-745-513-1755x6464 consumer reality.,Phone_number,001-745-513-1755x6464,Phone_number,001-745-513-1755x6464,TRUE,TRUE
1707621881 Career respond front happen decide. History hair least exist sit similar them. Play near near middle natural rich.,Phone_number,1707621881,Phone_number,1707621881,TRUE,TRUE
+1-552-819-0522x1680 Fine during five spring page where language. Partner onto fight your treat already best. Professional town media hope newspaper order.,Phone_number,+1-552-819-0522x1680,Phone_number,+1-552-819-0522x1680,TRUE,TRUE
Cup item remain environment not. Foot nation key high seek eight. 870.272.7727x199,Phone_number,870.272.7727x199,Phone_number,870.272.7727x199,TRUE,TRUE
068.628.9455x185 Question as should sign face. Memory approach month back.,Phone_number,068.628.9455x185,Phone_number,068.628.9455x185,TRUE,TRUE
(945)040-6331x9814 Sound improve parent dream send language. Hundred better down understand treatment able. Partner kid want feel action yeah.,Phone_number,(945)040-6331x9814,Phone_number,(945)040-6331x9814,TRUE,TRUE
We trial win. Indeed hotel dream. Poor friend 870.272.7727x199 go east above.,Phone_number,870.272.7727x199,Phone_number,870.272.7727x199,TRUE,TRUE
Series painting development simply good. Hour 506-206-8403 cultural so only group.,Phone_number,506-206-8403,Phone_number,506-206-8403,TRUE,TRUE
688.244.4739x098 Gun billion skin. Find success force state within.,Phone_number,688.244.4739x098,Phone_number,688.244.4739x098,TRUE,TRUE
Wear language word kitchen might figure miss join. Large hear security year during 001-745-513-1755x6464 reach watch.,Phone_number,001-745-513-1755x6464,Phone_number,001-745-513-1755x6464,TRUE,TRUE
Organization rich indicate medical (271)988-8621 everyone industry. Under word director value. Candidate help anything weight specific.,Phone_number,(271)988-8621,Phone_number,(271)988-8621,TRUE,TRUE
Job security fall bad good relationship. List area away federal necessary. Wind all stage time (574)160-3737 animal.,Phone_number,(574)160-3737,Phone_number,(574)160-3737,TRUE,TRUE
Lay (945)040-6331x9814 case final. East dark week account structure red company give.,Phone_number,(945)040-6331x9814,Phone_number,(945)040-6331x9814,TRUE,TRUE
Community stand nice whatever film. Blood go particular same wait record interview. Position sometimes test shoulder save huge course. Almost they himself +1-771-342-3951x005 less interesting education.,Phone_number,+1-771-342-3951x005,Phone_number,+1-771-342-3951x005,TRUE,TRUE
View consumer our. Kind simple support. Operation 8858704181 Democrat off red economic environment human.,Phone_number,8858704181,Phone_number,8858704181,TRUE,TRUE
001-942-132-8159x6046 Soon study though once. Former grow around morning guy activity.,Phone_number,001-942-132-8159x6046,Phone_number,001-942-132-8159x6046,TRUE,TRUE
Although foreign national clearly church establish in 996-294-4022 first. Approach situation hair animal team. Across hospital bag.,Phone_number,996-294-4022,Phone_number,996-294-4022,TRUE,TRUE
Mission throughout small save still lay discussion 413-613-8399x27965 according. Spend man finally finish some officer.,Phone_number,413-613-8399x27965,Phone_number,413-613-8399x27965,TRUE,TRUE
712-204-4405x2487 Member evening ready. Choose quality traditional create town common American.,Phone_number,712-204-4405x2487,Phone_number,712-204-4405x2487,TRUE,TRUE
Support do total threat exist material. Here boy move much. Candidate will data agency field care. Page task opportunity door board +1-886-982-9562 sound ready.,Phone_number,-11429,Phone_number,-11429,TRUE,TRUE
Close pressure finally. Young question Mrs leg group president. 8228322980,Phone_number,8228322980,Phone_number,8228322980,TRUE,TRUE
Quality whom pay travel our table course. Likely 336.570.1816x48958 other out.,Phone_number,336.570.1816x48958,Phone_number,336.570.1816x48958,TRUE,TRUE
Relationship 196.486.6321x198 what family state time artist side. Oil second social collection east natural during. Popular lead its federal eight I.,Phone_number,196.486.6321x198,Phone_number,196.486.6321x198,TRUE,TRUE
(945)040-6331x9814 Everyone road skill act condition heart real wear. Left song very foreign bed soldier.,Phone_number,(945)040-6331x9814,Phone_number,(945)040-6331x9814,TRUE,TRUE
Fight strategy maintain every because religious 420.928.3944 bed.,Phone_number,420.928.3944,Phone_number,420.928.3944,TRUE,TRUE
Most 702.963.2622 nor star remain.,Phone_number,702.963.2622,Phone_number,702.963.2622,TRUE,TRUE
Team Republican 712-204-4405x2487 him reveal. Player party leg beyond.,Phone_number,712-204-4405x2487,Phone_number,712-204-4405x2487,TRUE,TRUE
One than light class. Between 336.993.8856 impact those cold truth.,Phone_number,336.993.8856,Phone_number,336.993.8856,TRUE,TRUE
During technology 5042847983 weight appear gun. Soon claim method. Parent between role travel.,Phone_number,5042847983,Phone_number,5042847983,TRUE,TRUE
Room up generation free discover grow. Pattern authority 001-445-050-6687x71913 effort himself. Avoid lawyer name.,Phone_number,001-445-050-6687x71913,Phone_number,001-445-050-6687x71913,TRUE,TRUE
Never break about risk. Pay number west economic test involve agent 419.717.0728 boy. Number least seat expert class watch work.,Phone_number,419.717.0728,Phone_number,419.717.0728,TRUE,TRUE
