Text,Labels,PII,Labels_found,PII_found,Match_Labels,Match_PII
During technology weight appear gun. Soon claim method. Parent between role travel. 2539669222044446,CreditCardNumber,2.53967E+15,CreditCardNumber,2.53967E+15,TRUE,TRUE
Room up generation free discover grow. Pattern authority 4914569109182 effort himself. Avoid lawyer name.,CreditCardNumber,4.91457E+12,CreditCardNumber,4.91457E+12,TRUE,TRUE
Never break about risk. Pay number west economic test 3536439571940276 involve agent boy. Number least seat expert class watch work.,CreditCardNumber,3.53644E+15,CreditCardNumber,3.53644E+15,TRUE,TRUE
Strong whole head name mean. American lose 180094837534853 animal well position strategy growth Republican. Common the term ability choice Republican last.,CreditCardNumber,1.80095E+14,CreditCardNumber,1.80095E+14,TRUE,TRUE
Ok dream campaign task six only 4562690712104207 Congress. Score account fund various onto will.,CreditCardNumber,4.56269E+15,CreditCardNumber,4.56269E+15,TRUE,TRUE
Town minute 676115522119 culture throughout business. Under stay occur hot.,CreditCardNumber,6.76116E+11,CreditCardNumber,6.76116E+11,TRUE,TRUE
Radio respond perhaps western loss blood. Turn list economy itself executive indeed with. Final so environmental relationship or arrive idea church. Fast 4824730605358 exactly raise city push live benefit else.,CreditCardNumber,4.82473E+12,CreditCardNumber,4.82473E+12,TRUE,TRUE
Approach article scene though respond white song. Pick PM 6563716230495464 even white still. Keep north reflect away property standard.,CreditCardNumber,6.56372E+15,CreditCardNumber,6.56372E+15,TRUE,TRUE
Cell town administration arm. 4616277450788213 Say range watch our shoulder as.,CreditCardNumber,4.61628E+15,CreditCardNumber,4.61628E+15,TRUE,TRUE
Goal agent resource 4993313326896 office material game. Lot scene help. Answer visit southern situation. Fall country win out rather dinner marriage.,CreditCardNumber,4.99331E+12,CreditCardNumber,4.99331E+12,TRUE,TRUE
History effort system kitchen. Heart your 6558145461622090 situation act forget question factor. Evening be white will work debate.,CreditCardNumber,6.55815E+15,CreditCardNumber,6.55815E+15,TRUE,TRUE
4799645906604147647 Leader any type improve first black child. Avoid list political thing. Model during white note various night.,CreditCardNumber,4.79965E+18,CreditCardNumber,4.79965E+18,TRUE,TRUE
Thank 4799645906604147647 realize edge quality agency. Mrs produce manage this people see police. Hospital campaign message create people concern. Order bring alone set including.,CreditCardNumber,4.79965E+18,CreditCardNumber,4.79965E+18,TRUE,TRUE
Discover author 6558145461622090 see president return man last. Black door already card increase dog minute. Think approach itself season.,CreditCardNumber,6.55815E+15,CreditCardNumber,6.55815E+15,TRUE,TRUE
Easy have whatever point 3584995274800308 better. Instead measure game.,CreditCardNumber,3.585E+15,CreditCardNumber,3.585E+15,TRUE,TRUE
Party woman past grow edge. Pretty eat Democrat source return party. 630466700238,CreditCardNumber,6.30467E+11,CreditCardNumber,6.30467E+11,TRUE,TRUE
Series seem sister health. Identify 4684949676197398 company authority seek scene concern. Yes pick father.,CreditCardNumber,4.68495E+15,CreditCardNumber,4.68495E+15,TRUE,TRUE
Old to health ask figure. Fill when 2383084986841820 hotel girl yet fill defense service. Someone page successful.,CreditCardNumber,2.38308E+15,CreditCardNumber,2.38308E+15,TRUE,TRUE
Movie statement leader ready ok follow debate. Trouble work article author fish. Radio 4874227443515985953 glass individual fact work road though positive.,CreditCardNumber,4.87423E+18,CreditCardNumber,4.87423E+18,TRUE,TRUE
Exist establish we 4534678333333995 reason job record accept. Western nearly region own view protect.,CreditCardNumber,4.53468E+15,CreditCardNumber,4.53468E+15,TRUE,TRUE
First 375652905145590 resource test rate. Father beat family prove meeting customer. Strategy both ground able light service during.,CreditCardNumber,3.75653E+14,CreditCardNumber,3.75653E+14,TRUE,TRUE
Civil notice travel commercial. Consumer itself edge generation wait magazine sister. Hour care help foreign 2717717309410354 his test.,CreditCardNumber,2.71772E+15,CreditCardNumber,2.71772E+15,TRUE,TRUE
Also six million group reach future. Personal politics performance magazine mention institution relationship. Health present true pressure. 4674473076627534,CreditCardNumber,4.67447E+15,CreditCardNumber,4.67447E+15,TRUE,TRUE
Program indicate whose attorney five according. Young 4629177236538 citizen interview speech nor. Everything five clear left quite watch home sound.,CreditCardNumber,4.62918E+12,CreditCardNumber,4.62918E+12,TRUE,TRUE
Such today election away. Month color officer room 4134320820980129 no. Weight night letter care too.,CreditCardNumber,4.13432E+15,CreditCardNumber,4.13432E+15,TRUE,TRUE
Nature American should reduce two. Store goal entire 30483588661316 prove sure Democrat hope. Dog can computer.,CreditCardNumber,3.04836E+13,CreditCardNumber,3.04836E+13,TRUE,TRUE
Defense 4282096422839141 region trade hold bed time audience choice. Sell of heart. Practice north white off.,CreditCardNumber,4.2821E+15,CreditCardNumber,4.2821E+15,TRUE,TRUE
Still yes everyone 4784347033943141075 section center feel. View real late. Test financial success apply.,CreditCardNumber,4.78435E+18,CreditCardNumber,4.78435E+18,TRUE,TRUE
Certainly success training idea large. Majority food behind. Project voice 4026476129080910493 alone trouble. Away relationship mother.,CreditCardNumber,4.02648E+18,CreditCardNumber,4.02648E+18,TRUE,TRUE
Around well meet whose five before. Some or most add. Want 375652905145590 option meeting say.,CreditCardNumber,3.75653E+14,CreditCardNumber,3.75653E+14,TRUE,TRUE
Federal nice this idea sell. 180057624136760 If somebody watch without best.,CreditCardNumber,1.80058E+14,CreditCardNumber,1.80058E+14,TRUE,TRUE
Year not special must run since. 4824730605358 Stuff their better of public good.,CreditCardNumber,4.82473E+12,CreditCardNumber,4.82473E+12,TRUE,TRUE
Add three Democrat deep bill appear. Or box traditional majority. Analysis 2292168032216473 fly teacher court like president.,CreditCardNumber,2.29217E+15,CreditCardNumber,2.29217E+15,TRUE,TRUE
Feel thank 4534678333333995 whether threat spring third position. Away magazine whatever source answer ability. Election shoulder like student peace.,CreditCardNumber,4.53468E+15,CreditCardNumber,4.53468E+15,TRUE,TRUE
She late away line 2717717309410354 recent employee. Several past personal.,CreditCardNumber,2.71772E+15,CreditCardNumber,2.71772E+15,TRUE,TRUE
Nearly but foreign. Much value beat second poor feeling work. Then picture them water window. 30499076878519,CreditCardNumber,3.04991E+13,CreditCardNumber,3.04991E+13,TRUE,TRUE
Character film 4533617093671765 whole above operation player cause.,CreditCardNumber,4.53362E+15,CreditCardNumber,4.53362E+15,TRUE,TRUE
Drop yet bad each whose. Machine board size special care 4993313326896 hear.,CreditCardNumber,4.99331E+12,CreditCardNumber,4.99331E+12,TRUE,TRUE
Road audience large 2240547383093594 this. Future artist condition cut. Recent still a trip fine. Thought again ever price shake relate.,CreditCardNumber,2.24055E+15,CreditCardNumber,2.24055E+15,TRUE,TRUE
Upon some challenge Democrat perhaps. Way beat institution another decide behavior agent. 6557203992442479,CreditCardNumber,6.5572E+15,CreditCardNumber,6.5572E+15,TRUE,TRUE
Again while skill difficult 676257183670 responsibility. Hard woman final. But still system top.,CreditCardNumber,6.76257E+11,CreditCardNumber,6.76257E+11,TRUE,TRUE
Try arrive vote moment recognize. Compare 4533091627782 ever over house list quickly.,CreditCardNumber,4.53309E+12,CreditCardNumber,4.53309E+12,TRUE,TRUE
Network article for eight same. Receive meet service true 2292168032216473 other. Law already people add style paper eye.,CreditCardNumber,2.29217E+15,CreditCardNumber,2.29217E+15,TRUE,TRUE
Any information garden to 6557203992442479 citizen movie hear authority. Full control method debate project product list. Fall public individual action imagine agent.,CreditCardNumber,6.5572E+15,CreditCardNumber,6.5572E+15,TRUE,TRUE
Same likely fear detail clearly. And song find power toward sometimes leader. 3525878614270402 Family coach like outside price financial.,CreditCardNumber,3.52588E+15,CreditCardNumber,3.52588E+15,TRUE,TRUE
Break light base sea. 4784347033943141075 Magazine decide crime government wrong half consider. Herself decide produce its against off many exist.,CreditCardNumber,4.78435E+18,CreditCardNumber,4.78435E+18,TRUE,TRUE
Effect born weight democratic official 4874227443515985953 agreement. Glass hear artist not teacher.,CreditCardNumber,4.87423E+18,CreditCardNumber,4.87423E+18,TRUE,TRUE
Talk while American suddenly participant second account. Anything whole ok car store tough want manager. 3567193840958385,CreditCardNumber,3.56719E+15,CreditCardNumber,3.56719E+15,TRUE,TRUE
Camera wall continue top us 349016993336714 clearly hot including.,CreditCardNumber,3.49017E+14,CreditCardNumber,3.49017E+14,TRUE,TRUE
Course college still loss 4874227443515985953 scene. Series many speech law film.,CreditCardNumber,4.87423E+18,CreditCardNumber,4.87423E+18,TRUE,TRUE
Movement near 4929609498410366998 value number able ability result table.,CreditCardNumber,4.92961E+18,CreditCardNumber,4.92961E+18,TRUE,TRUE
Pull key other nor save perform. List service ready 4824730605358 yard clearly.,CreditCardNumber,4.82473E+12,CreditCardNumber,4.82473E+12,TRUE,TRUE
Ready off score foot market 4724466171033343 protect.,CreditCardNumber,4.72447E+15,CreditCardNumber,4.72447E+15,TRUE,TRUE
Up course education involve thousand. Treat scientist actually study avoid education. 30579838131834 Floor out language laugh tough rule investment.,CreditCardNumber,3.05798E+13,CreditCardNumber,3.05798E+13,TRUE,TRUE
Huge develop 375660488040203 environmental president their. Manage could outside professional power question this. Point learn tonight again whom true rate.,CreditCardNumber,3.7566E+14,CreditCardNumber,3.7566E+14,TRUE,TRUE
Possible both develop claim. Call than message simple class. 4697146355792079,CreditCardNumber,4.69715E+15,CreditCardNumber,4.69715E+15,TRUE,TRUE
Describe question 6557590208608483 cover suggest actually with. Course fly hope require she. Season real keep each sign fly. Common take compare force.,CreditCardNumber,6.55759E+15,CreditCardNumber,6.55759E+15,TRUE,TRUE
Per learn agree despite smile him foot. Wait should effect from. Close make result. Fish strong which force 4632237099089597 next teach newspaper.,CreditCardNumber,4.63224E+15,CreditCardNumber,4.63224E+15,TRUE,TRUE
Director thousand manager give 4674473076627534 board white. Result how more southern. Fact guess to.,CreditCardNumber,4.67447E+15,CreditCardNumber,4.67447E+15,TRUE,TRUE
Report author increase a 4730553981548548163 receive watch. Book rather imagine. Decision hit result able store future development source.,CreditCardNumber,4.73055E+18,CreditCardNumber,4.73055E+18,TRUE,TRUE
Positive cause I arrive night site wind. Throughout mind over 2383084986841820 he collection hit. Fall challenge action through.,CreditCardNumber,2.38308E+15,CreditCardNumber,2.38308E+15,TRUE,TRUE
Store effort campaign girl worker technology. Fact reach somebody sense. Run run tonight soldier. World trade 676293890015 play account up single.,CreditCardNumber,6.76294E+11,CreditCardNumber,6.76294E+11,TRUE,TRUE
Coach he west magazine against beat. By 344984586232209 sometimes series time whole election prove. Series protect program may peace answer.,CreditCardNumber,3.44985E+14,CreditCardNumber,3.44985E+14,TRUE,TRUE
Speech national especially available own black alone. After friend religious 3563330148426475 unit movement not pretty all.,CreditCardNumber,3.56333E+15,CreditCardNumber,3.56333E+15,TRUE,TRUE
Forward listen step this community financial most. Deal item all. Subject consider care 630466700238 training.,CreditCardNumber,6.30467E+11,CreditCardNumber,6.30467E+11,TRUE,TRUE
36761511679610 Test artist person billion. Trouble staff industry measure sense before.,CreditCardNumber,3.67615E+13,CreditCardNumber,3.67615E+13,TRUE,TRUE
Group think step increase answer know. Agreement question develop. Use far kitchen impact thus moment at. 30102328410277,CreditCardNumber,3.01023E+13,CreditCardNumber,3.01023E+13,TRUE,TRUE
lowejennifer@smith-michael.com Candidate economic character present money daughter world well. Open analysis center.,Email,lowejennifer@smith-michael.com,Email,lowejennifer@smith-michael.com,TRUE,TRUE
Film range sound. People age that. douglaslewis@yahoo.com,Email,douglaslewis@yahoo.com,Email,douglaslewis@yahoo.com,TRUE,TRUE
Back want tamarafox@torres.com myself class certain. Tree pretty career environment change letter top.,Email,tamarafox@torres.com,Email,tamarafox@torres.com,TRUE,TRUE
Bring guy hold green cummingsmadeline@pearson.com girl.,Email,cummingsmadeline@pearson.com,Email,cummingsmadeline@pearson.com,TRUE,TRUE
May lay not boy case citizen. Woman executive dog pull rrice@yahoo.com traditional dinner.,Email,rrice@yahoo.com,Email,rrice@yahoo.com,TRUE,TRUE
collinsjesus@gmail.com Themselves early our bit. Institution peace spring agree ever. Involve do play realize true consumer reality.,Email,collinsjesus@gmail.com,Email,collinsjesus@gmail.com,TRUE,TRUE
Career respond front joanna23@yahoo.com happen decide. History hair least exist sit similar them. Play near near middle natural rich.,Email,joanna23@yahoo.com,Email,joanna23@yahoo.com,TRUE,TRUE
Fine during five spring page where language. Partner onto angela27@bradley.net fight your treat already best. Professional town media hope newspaper order.,Email,angela27@bradley.net,Email,angela27@bradley.net,TRUE,TRUE
Cup item remain environment not. barry50@hotmail.com Foot nation key high seek eight.,Email,barry50@hotmail.com,Email,barry50@hotmail.com,TRUE,TRUE
Question as should sign face. Memory approach month xsullivan@peterson.com back.,Email,xsullivan@peterson.com,Email,xsullivan@peterson.com,TRUE,TRUE
Sound improve parent dream send language. Hundred better down understand treatment john10@yahoo.com able. Partner kid want feel action yeah.,Email,john10@yahoo.com,Email,john10@yahoo.com,TRUE,TRUE
We trial win. Indeed hotel michelle38@gmail.com dream. Poor friend go east above.,Email,michelle38@gmail.com,Email,michelle38@gmail.com,TRUE,TRUE
Series painting development simply douglaslewis@yahoo.com good. Hour cultural so only group.,Email,douglaslewis@yahoo.com,Email,douglaslewis@yahoo.com,TRUE,TRUE
Gun billion skin. Find success force state dsimpson@yahoo.com within.,Email,dsimpson@yahoo.com,Email,dsimpson@yahoo.com,TRUE,TRUE
Wear language word kitchen might figure miss join. Large hear syoung@simpson-huerta.com security year during reach watch.,Email,syoung@simpson-huerta.com,Email,syoung@simpson-huerta.com,TRUE,TRUE
Organization rich indicate medical everyone industry. matthewlong@hotmail.com Under word director value. Candidate help anything weight specific.,Email,matthewlong@hotmail.com,Email,matthewlong@hotmail.com,TRUE,TRUE
Job security fall bad good relationship. List area away federal necessary. Wind all stage time animal. halltracy@wood.com,Email,halltracy@wood.com,Email,halltracy@wood.com,TRUE,TRUE
Lay case final. East dark week sherri68@gmail.com account structure red company give.,Email,sherri68@gmail.com,Email,sherri68@gmail.com,TRUE,TRUE
Community stand nice whatever film. Blood go particular same wait record interview. Position sometimes test shoulder save huge course. Almost they diazamanda@johnson.info himself less interesting education.,Email,diazamanda@johnson.info,Email,diazamanda@johnson.info,TRUE,TRUE
View consumer our. christinelewis@hill-rowe.com Kind simple support. Operation Democrat off red economic environment human.,Email,christinelewis@hill-rowe.com,Email,christinelewis@hill-rowe.com,TRUE,TRUE
Soon study though once. jwarren@sandoval.biz Former grow around morning guy activity.,Email,jwarren@sandoval.biz,Email,jwarren@sandoval.biz,TRUE,TRUE
Although foreign national clearly church establish in first. Approach situation hair animal team. Across hospital bag. jennifergreen@rivera.com,Email,jennifergreen@rivera.com,Email,jennifergreen@rivera.com,TRUE,TRUE
Mission throughout small save still lay discussion according. Spend man zdawson@hotmail.com finally finish some officer.,Email,zdawson@hotmail.com,Email,zdawson@hotmail.com,TRUE,TRUE
reneebooth@neal.com Member evening ready. Choose quality traditional create town common American.,Email,reneebooth@neal.com,Email,reneebooth@neal.com,TRUE,TRUE
Support do total threat exist material. Here angela27@bradley.net boy move much. Candidate will data agency field care. Page task opportunity door board sound ready.,Email,angela27@bradley.net,Email,angela27@bradley.net,TRUE,TRUE
Close pressure finally. Young question sandovalfrank@morris.com Mrs leg group president.,Email,sandovalfrank@morris.com,Email,sandovalfrank@morris.com,TRUE,TRUE
Quality jacobyates@stokes.com whom pay travel our table course. Likely other out.,Email,jacobyates@stokes.com,Email,jacobyates@stokes.com,TRUE,TRUE
Relationship what family state time artist side. Oil second social collection east natural during. Popular lead its federal eight I. freyandrew@mitchell.com,Email,freyandrew@mitchell.com,Email,freyandrew@mitchell.com,TRUE,TRUE
Everyone road skill act condition heart frobinson@romero.info real wear. Left song very foreign bed soldier.,Email,frobinson@romero.info,Email,frobinson@romero.info,TRUE,TRUE
Fight strategy maintain every because religious reneebooth@neal.com bed.,Email,reneebooth@neal.com,Email,reneebooth@neal.com,TRUE,TRUE
Most khamilton@yahoo.com nor star remain.,Email,khamilton@yahoo.com,Email,khamilton@yahoo.com,TRUE,TRUE
Team Republican him reveal. Player party richardbeard@hotmail.com leg beyond.,Email,richardbeard@hotmail.com,Email,richardbeard@hotmail.com,TRUE,TRUE
One than light class. Between impact elizabeth68@allison.net those cold truth.,Email,elizabeth68@allison.net,Email,elizabeth68@allison.net,TRUE,TRUE
During technology weight appear gun. Soon claim method. Parent between joanna23@yahoo.com role travel.,Email,joanna23@yahoo.com,Email,joanna23@yahoo.com,TRUE,TRUE
Room up generation owilson@pineda.net free discover grow. Pattern authority effort himself. Avoid lawyer name.,Email,owilson@pineda.net,Email,owilson@pineda.net,TRUE,TRUE
Never break about risk. Pay number stephenhudson@moore.com west economic test involve agent boy. Number least seat expert class watch work.,Email,stephenhudson@moore.com,Email,stephenhudson@moore.com,TRUE,TRUE
Strong whole head name alexanderfuller@gmail.com mean. American lose animal well position strategy growth Republican. Common the term ability choice Republican last.,Email,alexanderfuller@gmail.com,Email,alexanderfuller@gmail.com,TRUE,TRUE
joe51@cannon-cunningham.com Ok dream campaign task six only Congress. Score account fund various onto will.,Email,joe51@cannon-cunningham.com,Email,joe51@cannon-cunningham.com,TRUE,TRUE
Town minute culture throughout business. Under stay occur hot. friley@zavala-griffith.com,Email,friley@zavala-griffith.com,Email,friley@zavala-griffith.com,TRUE,TRUE
Radio respond perhaps western loss blood. Turn list economy itself executive indeed with. Final so environmental relationship jrodriguez@mccarthy-lawson.biz or arrive idea church. Fast exactly raise city push live benefit else.,Email,jrodriguez@mccarthy-lawson.biz,Email,jrodriguez@mccarthy-lawson.biz,TRUE,TRUE
Approach article scene though respond white song. Pick PM even white still. Keep north martinvalerie@cruz-collins.com reflect away property standard.,Email,martinvalerie@cruz-collins.com,Email,martinvalerie@cruz-collins.com,TRUE,TRUE
Cell town lowens@hotmail.com administration arm. Say range watch our shoulder as.,Email,lowens@hotmail.com,Email,lowens@hotmail.com,TRUE,TRUE
Goal agent resource office material game. Lot scene jennifergreen@rivera.com help. Answer visit southern situation. Fall country win out rather dinner marriage.,Email,jennifergreen@rivera.com,Email,jennifergreen@rivera.com,TRUE,TRUE
History effort system kitchen. Heart your situation act forget owilson@pineda.net question factor. Evening be white will work debate.,Email,owilson@pineda.net,Email,owilson@pineda.net,TRUE,TRUE
Leader any type improve first black child. heathergibson@miller.com Avoid list political thing. Model during white note various night.,Email,heathergibson@miller.com,Email,heathergibson@miller.com,TRUE,TRUE
Thank realize edge quality agency. Mrs produce manage this people see police. Hospital campaign message create people concern. Order bring joelbailey@brown-velez.com alone set including.,Email,joelbailey@brown-velez.com,Email,joelbailey@brown-velez.com,TRUE,TRUE
Discover author see president return man last. Black door already card increase dog minute. Think joe51@cannon-cunningham.com approach itself season.,Email,joe51@cannon-cunningham.com,Email,joe51@cannon-cunningham.com,TRUE,TRUE
Easy xsullivan@peterson.com have whatever point better. Instead measure game.,Email,xsullivan@peterson.com,Email,xsullivan@peterson.com,TRUE,TRUE
Party tamarafox@torres.com woman past grow edge. Pretty eat Democrat source return party.,Email,tamarafox@torres.com,Email,tamarafox@torres.com,TRUE,TRUE
Series seem sister health. Identify company authority bellteresa@hines-clark.com seek scene concern. Yes pick father.,Email,bellteresa@hines-clark.com,Email,bellteresa@hines-clark.com,TRUE,TRUE
Old to health ask martinmichelle@wilkinson.com figure. Fill when hotel girl yet fill defense service. Someone page successful.,Email,martinmichelle@wilkinson.com,Email,martinmichelle@wilkinson.com,TRUE,TRUE
Movie statement leader ready ok follow debate. Trouble work article author fish. Radio glass individual samuelgilbert@sherman.info fact work road though positive.,Email,samuelgilbert@sherman.info,Email,samuelgilbert@sherman.info,TRUE,TRUE
Exist establish we reason job record accept. Western nearly region own susan14@holden.net view protect.,Email,susan14@holden.net,Email,susan14@holden.net,TRUE,TRUE
First resource test rate. Father beat family prove robertsallison@gmail.com meeting customer. Strategy both ground able light service during.,Email,robertsallison@gmail.com,Email,robertsallison@gmail.com,TRUE,TRUE
Civil notice travel commercial. Consumer itself edge generation wait magazine sister. Hour care help jwarren@sandoval.biz foreign his test.,Email,jwarren@sandoval.biz,Email,jwarren@sandoval.biz,TRUE,TRUE
Also six million timothycraig@payne.info group reach future. Personal politics performance magazine mention institution relationship. Health present true pressure.,Email,timothycraig@payne.info,Email,timothycraig@payne.info,TRUE,TRUE
Program indicate whose attorney five according. Young citizen interview speech nor. Everything five clear elizabethwiggins@weaver.info left quite watch home sound.,Email,elizabethwiggins@weaver.info,Email,elizabethwiggins@weaver.info,TRUE,TRUE
Such today election away. Month color officer room no. Weight kennethallen@turner.com night letter care too.,Email,kennethallen@turner.com,Email,kennethallen@turner.com,TRUE,TRUE
Nature American should reduce two. Store goal entire prove jacobyates@stokes.com sure Democrat hope. Dog can computer.,Email,jacobyates@stokes.com,Email,jacobyates@stokes.com,TRUE,TRUE
Defense region trade hold bed time audience choice. Sell of heart. Practice north lowens@hotmail.com white off.,Email,lowens@hotmail.com,Email,lowens@hotmail.com,TRUE,TRUE
Still yes everyone section center feel. jwarren@sandoval.biz View real late. Test financial success apply.,Email,jwarren@sandoval.biz,Email,jwarren@sandoval.biz,TRUE,TRUE
Certainly success training idea large. Majority food behind. stacy51@yahoo.com Project voice alone trouble. Away relationship mother.,Email,stacy51@yahoo.com,Email,stacy51@yahoo.com,TRUE,TRUE
Around well meet whose five before. Some or most add. Want susan14@holden.net option meeting say.,Email,susan14@holden.net,Email,susan14@holden.net,TRUE,TRUE
Federal nice martinvalerie@cruz-collins.com this idea sell. If somebody watch without best.,Email,martinvalerie@cruz-collins.com,Email,martinvalerie@cruz-collins.com,TRUE,TRUE
Year not special must run since. Stuff their better of public joelbailey@brown-velez.com good.,Email,joelbailey@brown-velez.com,Email,joelbailey@brown-velez.com,TRUE,TRUE
Add three Democrat deep rrice@yahoo.com bill appear. Or box traditional majority. Analysis fly teacher court like president.,Email,rrice@yahoo.com,Email,rrice@yahoo.com,TRUE,TRUE
Feel thank whether threat spring third position. Away magazine whatever source frobinson@romero.info answer ability. Election shoulder like student peace.,Email,frobinson@romero.info,Email,frobinson@romero.info,TRUE,TRUE
She late away stephanie41@yahoo.com line recent employee. Several past personal.,Email,stephanie41@yahoo.com,Email,stephanie41@yahoo.com,TRUE,TRUE
Nearly but foreign. Much value beat second poor feeling work. Then picture them kennethallen@turner.com water window.,Email,kennethallen@turner.com,Email,kennethallen@turner.com,TRUE,TRUE
lwilliams@yahoo.com Character film whole above operation player cause.,Email,lwilliams@yahoo.com,Email,lwilliams@yahoo.com,TRUE,TRUE
zyoung@drake.org Drop yet bad each whose. Machine board size special care hear.,Email,zyoung@drake.org,Email,zyoung@drake.org,TRUE,TRUE
Road audience large this. dana18@alvarez.com Future artist condition cut. Recent still a trip fine. Thought again ever price shake relate.,Email,dana18@alvarez.com,Email,dana18@alvarez.com,TRUE,TRUE
